"No.","Time","Source","Destination","Protocol","Length","Info","TLS server name","Flags"
"1","0.000000","10.100.102.162","185.15.59.224","TCP","66","58383  >  443 [SYN] Seq=0 Win=65535 Len=0 MSS=1460 WS=256 SACK_PERM","","0x002"
"2","0.073654","185.15.59.224","10.100.102.162","TCP","66","443  >  58383 [SYN, ACK] Seq=0 Ack=1 Win=42340 Len=0 MSS=1440 SACK_PERM WS=512","","0x012"
"3","0.073720","10.100.102.162","185.15.59.224","TCP","54","58383  >  443 [ACK] Seq=1 Ack=1 Win=65280 Len=0","","0x010"
"4","0.074301","10.100.102.162","185.15.59.224","TCP","1494","58383  >  443 [ACK] Seq=1 Ack=1 Win=65280 Len=1440 [TCP PDU reassembled in 5]","","0x010"
"5","0.074301","10.100.102.162","185.15.59.224","TLSv1.3","340","Client Hello (SNI=he.wikipedia.org)","he.wikipedia.org","0x018"
"6","0.143863","185.15.59.224","10.100.102.162","TCP","60","443  >  58383 [ACK] Seq=1 Ack=1727 Win=41472 Len=0","","0x010"
"7","0.143863","185.15.59.224","10.100.102.162","TLSv1.3","1506","Server Hello, Change Cipher Spec, Application Data","","0x010"
"8","0.144262","185.15.59.224","10.100.102.162","TCP","1506","443  >  58383 [PSH, ACK] Seq=1453 Ack=1727 Win=42496 Len=1452 [TCP PDU reassembled in 10]","","0x018"
"9","0.144309","10.100.102.162","185.15.59.224","TCP","54","58383  >  443 [ACK] Seq=1727 Ack=2905 Win=65280 Len=0","","0x010"
"10","0.144668","185.15.59.224","10.100.102.162","TLSv1.3","1021","Application Data, Application Data, Application Data","","0x018"
"11","0.147649","10.100.102.162","185.15.59.224","TLSv1.3","118","Change Cipher Spec, Application Data","","0x018"
"12","0.147813","10.100.102.162","185.15.59.224","TLSv1.3","146","Application Data","","0x018"
"13","0.147944","10.100.102.162","185.15.59.224","TLSv1.3","666","Application Data","","0x018"
"14","0.217418","185.15.59.224","10.100.102.162","TLSv1.3","309","Application Data","","0x018"
"15","0.217418","185.15.59.224","10.100.102.162","TLSv1.3","309","Application Data","","0x018"
"16","0.217418","185.15.59.224","10.100.102.162","TLSv1.3","106","Application Data","","0x018"
"17","0.217472","10.100.102.162","185.15.59.224","TCP","54","58383  >  443 [ACK] Seq=2495 Ack=4434 Win=65280 Len=0","","0x010"
"18","0.217669","10.100.102.162","185.15.59.224","TLSv1.3","85","Application Data","","0x018"
"19","0.217768","185.15.59.224","10.100.102.162","TCP","1506","443  >  58383 [ACK] Seq=4434 Ack=2495 Win=42496 Len=1452 [TCP PDU reassembled in 32]","","0x010"
"20","0.217790","10.100.102.162","185.15.59.224","TCP","54","58383  >  443 [ACK] Seq=2526 Ack=5886 Win=65280 Len=0","","0x010"
"21","0.218378","185.15.59.224","10.100.102.162","TCP","1506","443  >  58383 [PSH, ACK] Seq=5886 Ack=2495 Win=42496 Len=1452 [TCP PDU reassembled in 32]","","0x018"
"22","0.218378","185.15.59.224","10.100.102.162","TCP","1506","443  >  58383 [ACK] Seq=7338 Ack=2495 Win=42496 Len=1452 [TCP PDU reassembled in 32]","","0x010"
"23","0.218378","185.15.59.224","10.100.102.162","TCP","1506","443  >  58383 [PSH, ACK] Seq=8790 Ack=2495 Win=42496 Len=1452 [TCP PDU reassembled in 32]","","0x018"
"24","0.218427","10.100.102.162","185.15.59.224","TCP","54","58383  >  443 [ACK] Seq=2526 Ack=10242 Win=65280 Len=0","","0x010"
"25","0.222611","185.15.59.224","10.100.102.162","TCP","1506","443  >  58383 [ACK] Seq=10242 Ack=2495 Win=42496 Len=1452 [TCP PDU reassembled in 32]","","0x010"
"26","0.222611","185.15.59.224","10.100.102.162","TCP","1506","443  >  58383 [PSH, ACK] Seq=11694 Ack=2495 Win=42496 Len=1452 [TCP PDU reassembled in 32]","","0x018"
"27","0.222645","10.100.102.162","185.15.59.224","TCP","54","58383  >  443 [ACK] Seq=2526 Ack=13146 Win=65280 Len=0","","0x010"
"28","0.228190","185.15.59.224","10.100.102.162","TCP","1506","443  >  58383 [ACK] Seq=13146 Ack=2495 Win=42496 Len=1452 [TCP PDU reassembled in 32]","","0x010"
"29","0.228190","185.15.59.224","10.100.102.162","TCP","1506","443  >  58383 [PSH, ACK] Seq=14598 Ack=2495 Win=42496 Len=1452 [TCP PDU reassembled in 32]","","0x018"
"30","0.228233","10.100.102.162","185.15.59.224","TCP","54","58383  >  443 [ACK] Seq=2526 Ack=16050 Win=65280 Len=0","","0x010"
"31","0.233290","185.15.59.224","10.100.102.162","TCP","1506","443  >  58383 [ACK] Seq=16050 Ack=2495 Win=42496 Len=1452 [TCP PDU reassembled in 32]","","0x010"
"32","0.233290","185.15.59.224","10.100.102.162","TLSv1.3","1506","Application Data","","0x018"
"33","0.233340","10.100.102.162","185.15.59.224","TCP","54","58383  >  443 [ACK] Seq=2526 Ack=18954 Win=65280 Len=0","","0x010"
"34","0.269629","10.100.102.162","185.15.59.224","TLSv1.3","505","Application Data","","0x018"
"35","0.269736","10.100.102.162","185.15.59.224","TLSv1.3","183","Application Data","","0x018"
"36","0.276329","10.100.102.162","185.15.59.224","TLSv1.3","184","Application Data","","0x018"
"37","0.276366","10.100.102.162","185.15.59.224","TLSv1.3","172","Application Data","","0x018"
"38","0.286831","185.15.59.224","10.100.102.162","TCP","1506","443  >  58383 [ACK] Seq=18954 Ack=2495 Win=42496 Len=1452 [TCP PDU reassembled in 55]","","0x010"
"39","0.286905","10.100.102.162","185.15.59.224","TCP","54","58383  >  443 [ACK] Seq=3354 Ack=20406 Win=65280 Len=0","","0x010"
"40","0.287732","185.15.59.224","10.100.102.162","TCP","1506","443  >  58383 [PSH, ACK] Seq=20406 Ack=2495 Win=42496 Len=1452 [TCP PDU reassembled in 55]","","0x018"
"41","0.287791","10.100.102.162","185.15.59.224","TCP","54","58383  >  443 [ACK] Seq=3354 Ack=21858 Win=65280 Len=0","","0x010"
"42","0.289712","185.15.59.224","10.100.102.162","TCP","1506","443  >  58383 [ACK] Seq=21858 Ack=2495 Win=42496 Len=1452 [TCP PDU reassembled in 55]","","0x010"
"43","0.289712","185.15.59.224","10.100.102.162","TCP","1506","443  >  58383 [PSH, ACK] Seq=23310 Ack=2495 Win=42496 Len=1452 [TCP PDU reassembled in 55]","","0x018"
"44","0.289775","10.100.102.162","185.15.59.224","TCP","54","58383  >  443 [ACK] Seq=3354 Ack=24762 Win=65280 Len=0","","0x010"
"45","0.294991","185.15.59.224","10.100.102.162","TCP","1506","443  >  58383 [ACK] Seq=24762 Ack=2526 Win=42496 Len=1452 [TCP PDU reassembled in 55]","","0x010"
"46","0.294991","185.15.59.224","10.100.102.162","TCP","1506","443  >  58383 [PSH, ACK] Seq=26214 Ack=2526 Win=42496 Len=1452 [TCP PDU reassembled in 55]","","0x018"
"47","0.295030","10.100.102.162","185.15.59.224","TCP","54","58383  >  443 [ACK] Seq=3354 Ack=27666 Win=65280 Len=0","","0x010"
"48","0.300222","185.15.59.224","10.100.102.162","TCP","1506","443  >  58383 [ACK] Seq=27666 Ack=2526 Win=42496 Len=1452 [TCP PDU reassembled in 55]","","0x010"
"49","0.300222","185.15.59.224","10.100.102.162","TCP","1506","443  >  58383 [PSH, ACK] Seq=29118 Ack=2526 Win=42496 Len=1452 [TCP PDU reassembled in 55]","","0x018"
"50","0.300243","10.100.102.162","185.15.59.224","TCP","54","58383  >  443 [ACK] Seq=3354 Ack=30570 Win=65280 Len=0","","0x010"
"51","0.305329","185.15.59.224","10.100.102.162","TCP","1506","443  >  58383 [ACK] Seq=30570 Ack=2526 Win=42496 Len=1452 [TCP PDU reassembled in 55]","","0x010"
"52","0.305329","185.15.59.224","10.100.102.162","TCP","1506","443  >  58383 [PSH, ACK] Seq=32022 Ack=2526 Win=42496 Len=1452 [TCP PDU reassembled in 55]","","0x018"
"53","0.305385","10.100.102.162","185.15.59.224","TCP","54","58383  >  443 [ACK] Seq=3354 Ack=33474 Win=65280 Len=0","","0x010"
"54","0.310357","185.15.59.224","10.100.102.162","TCP","1506","443  >  58383 [ACK] Seq=33474 Ack=2526 Win=42496 Len=1452 [TCP PDU reassembled in 55]","","0x010"
"55","0.310357","185.15.59.224","10.100.102.162","TLSv1.3","1506","Application Data","","0x018"
"56","0.310396","10.100.102.162","185.15.59.224","TCP","54","58383  >  443 [ACK] Seq=3354 Ack=36378 Win=65280 Len=0","","0x010"
"57","0.315333","185.15.59.224","10.100.102.162","TCP","1506","443  >  58383 [ACK] Seq=36378 Ack=2526 Win=42496 Len=1452 [TCP PDU reassembled in 73]","","0x010"
"58","0.315333","185.15.59.224","10.100.102.162","TCP","1506","443  >  58383 [PSH, ACK] Seq=37830 Ack=2526 Win=42496 Len=1452 [TCP PDU reassembled in 73]","","0x018"
"59","0.315433","10.100.102.162","185.15.59.224","TCP","54","58383  >  443 [ACK] Seq=3354 Ack=39282 Win=65280 Len=0","","0x010"
"60","0.319811","185.15.59.224","10.100.102.162","TCP","1506","443  >  58383 [ACK] Seq=39282 Ack=2526 Win=42496 Len=1452 [TCP PDU reassembled in 73]","","0x010"
"61","0.319811","185.15.59.224","10.100.102.162","TCP","1506","443  >  58383 [PSH, ACK] Seq=40734 Ack=2526 Win=42496 Len=1452 [TCP PDU reassembled in 73]","","0x018"
"62","0.319863","10.100.102.162","185.15.59.224","TCP","54","58383  >  443 [ACK] Seq=3354 Ack=42186 Win=65280 Len=0","","0x010"
"63","0.324574","185.15.59.224","10.100.102.162","TCP","1506","443  >  58383 [ACK] Seq=42186 Ack=2526 Win=42496 Len=1452 [TCP PDU reassembled in 73]","","0x010"
"64","0.324574","185.15.59.224","10.100.102.162","TCP","1506","443  >  58383 [PSH, ACK] Seq=43638 Ack=2526 Win=42496 Len=1452 [TCP PDU reassembled in 73]","","0x018"
"65","0.324637","10.100.102.162","185.15.59.224","TCP","54","58383  >  443 [ACK] Seq=3354 Ack=45090 Win=65280 Len=0","","0x010"
"66","0.328713","185.15.59.224","10.100.102.162","TCP","1506","443  >  58383 [ACK] Seq=45090 Ack=2526 Win=42496 Len=1452 [TCP PDU reassembled in 73]","","0x010"
"67","0.328713","185.15.59.224","10.100.102.162","TCP","1506","443  >  58383 [PSH, ACK] Seq=46542 Ack=2526 Win=42496 Len=1452 [TCP PDU reassembled in 73]","","0x018"
"68","0.328763","10.100.102.162","185.15.59.224","TCP","54","58383  >  443 [ACK] Seq=3354 Ack=47994 Win=65280 Len=0","","0x010"
"69","0.332971","185.15.59.224","10.100.102.162","TCP","1506","443  >  58383 [ACK] Seq=47994 Ack=2526 Win=42496 Len=1452 [TCP PDU reassembled in 73]","","0x010"
"70","0.333033","10.100.102.162","185.15.59.224","TCP","54","58383  >  443 [ACK] Seq=3354 Ack=49446 Win=65280 Len=0","","0x010"
"71","0.333365","185.15.59.224","10.100.102.162","TCP","1506","443  >  58383 [PSH, ACK] Seq=49446 Ack=2526 Win=42496 Len=1452 [TCP PDU reassembled in 73]","","0x018"
"72","0.333425","10.100.102.162","185.15.59.224","TCP","54","58383  >  443 [ACK] Seq=3354 Ack=50898 Win=65280 Len=0","","0x010"
"73","0.337507","185.15.59.224","10.100.102.162","TLSv1.3","1506","Application Data","","0x010"
"74","0.337563","10.100.102.162","185.15.59.224","TCP","54","58383  >  443 [ACK] Seq=3354 Ack=52350 Win=65280 Len=0","","0x010"
"75","0.337884","185.15.59.224","10.100.102.162","TCP","1506","443  >  58383 [PSH, ACK] Seq=52350 Ack=2526 Win=42496 Len=1452 [TCP PDU reassembled in 92]","","0x018"
"76","0.337937","10.100.102.162","185.15.59.224","TCP","54","58383  >  443 [ACK] Seq=3354 Ack=53802 Win=65280 Len=0","","0x010"
"77","0.342473","185.15.59.224","10.100.102.162","TCP","1506","443  >  58383 [ACK] Seq=53802 Ack=2526 Win=42496 Len=1452 [TCP PDU reassembled in 92]","","0x010"
"78","0.342473","185.15.59.224","10.100.102.162","TCP","1506","443  >  58383 [PSH, ACK] Seq=55254 Ack=2526 Win=42496 Len=1452 [TCP PDU reassembled in 92]","","0x018"
"79","0.342505","10.100.102.162","185.15.59.224","TCP","54","58383  >  443 [ACK] Seq=3354 Ack=56706 Win=65280 Len=0","","0x010"
"80","0.346476","185.15.59.224","10.100.102.162","TCP","56","443  >  58383 [ACK] Seq=56706 Ack=3106 Win=42496 Len=0","","0x010"
"81","0.346476","185.15.59.224","10.100.102.162","TCP","56","443  >  58383 [ACK] Seq=56706 Ack=3354 Win=42496 Len=0","","0x010"
"82","0.355174","185.15.59.224","10.100.102.162","TCP","1506","443  >  58383 [ACK] Seq=56706 Ack=3354 Win=42496 Len=1452 [TCP PDU reassembled in 92]","","0x010"
"83","0.355174","185.15.59.224","10.100.102.162","TCP","1506","443  >  58383 [PSH, ACK] Seq=58158 Ack=3354 Win=42496 Len=1452 [TCP PDU reassembled in 92]","","0x018"
"84","0.355251","10.100.102.162","185.15.59.224","TCP","54","58383  >  443 [ACK] Seq=3354 Ack=59610 Win=65280 Len=0","","0x010"
"85","0.357316","185.15.59.224","10.100.102.162","TCP","1506","443  >  58383 [ACK] Seq=59610 Ack=3354 Win=42496 Len=1452 [TCP PDU reassembled in 92]","","0x010"
"86","0.357316","185.15.59.224","10.100.102.162","TCP","1506","443  >  58383 [PSH, ACK] Seq=61062 Ack=3354 Win=42496 Len=1452 [TCP PDU reassembled in 92]","","0x018"
"87","0.357388","10.100.102.162","185.15.59.224","TCP","54","58383  >  443 [ACK] Seq=3354 Ack=62514 Win=65280 Len=0","","0x010"
"88","0.361332","185.15.59.224","10.100.102.162","TCP","1506","443  >  58383 [ACK] Seq=62514 Ack=3354 Win=42496 Len=1452 [TCP PDU reassembled in 92]","","0x010"
"89","0.361332","185.15.59.224","10.100.102.162","TCP","1506","443  >  58383 [PSH, ACK] Seq=63966 Ack=3354 Win=42496 Len=1452 [TCP PDU reassembled in 92]","","0x018"
"90","0.361392","10.100.102.162","185.15.59.224","TCP","54","58383  >  443 [ACK] Seq=3354 Ack=65418 Win=65280 Len=0","","0x010"
"91","0.365442","185.15.59.224","10.100.102.162","TCP","1506","443  >  58383 [ACK] Seq=65418 Ack=3354 Win=42496 Len=1452 [TCP PDU reassembled in 92]","","0x010"
"92","0.365442","185.15.59.224","10.100.102.162","TLSv1.3","1506","Application Data, Application Data","","0x018"
"93","0.365508","10.100.102.162","185.15.59.224","TCP","54","58383  >  443 [ACK] Seq=3354 Ack=68322 Win=130816 Len=0","","0x010"
"94","0.368852","185.15.59.224","10.100.102.162","TLSv1.3","1506","Application Data","","0x010"
"95","0.368852","185.15.59.224","10.100.102.162","TLSv1.3","907","Application Data, Application Data","","0x018"
"96","0.368961","10.100.102.162","185.15.59.224","TCP","54","58383  >  443 [ACK] Seq=3354 Ack=70627 Win=130816 Len=0","","0x010"
"97","0.790785","10.100.102.162","185.15.59.224","TLSv1.3","169","Application Data","","0x018"
"98","0.858905","185.15.59.224","10.100.102.162","TCP","1506","443  >  58383 [ACK] Seq=70627 Ack=3469 Win=42496 Len=1452 [TCP PDU reassembled in 113]","","0x010"
"99","0.859259","185.15.59.224","10.100.102.162","TCP","1506","443  >  58383 [PSH, ACK] Seq=72079 Ack=3469 Win=42496 Len=1452 [TCP PDU reassembled in 113]","","0x018"
"100","0.859259","185.15.59.224","10.100.102.162","TCP","1506","443  >  58383 [ACK] Seq=73531 Ack=3469 Win=42496 Len=1452 [TCP PDU reassembled in 113]","","0x010"
"101","0.859293","10.100.102.162","185.15.59.224","TCP","54","58383  >  443 [ACK] Seq=3469 Ack=74983 Win=130816 Len=0","","0x010"
"102","0.859765","185.15.59.224","10.100.102.162","TCP","1506","443  >  58383 [PSH, ACK] Seq=74983 Ack=3469 Win=42496 Len=1452 [TCP PDU reassembled in 113]","","0x018"
"103","0.859793","10.100.102.162","185.15.59.224","TCP","54","58383  >  443 [ACK] Seq=3469 Ack=76435 Win=130816 Len=0","","0x010"
"104","0.861266","185.15.59.224","10.100.102.162","TCP","1506","443  >  58383 [ACK] Seq=76435 Ack=3469 Win=42496 Len=1452 [TCP PDU reassembled in 113]","","0x010"
"105","0.861266","185.15.59.224","10.100.102.162","TCP","1506","443  >  58383 [PSH, ACK] Seq=77887 Ack=3469 Win=42496 Len=1452 [TCP PDU reassembled in 113]","","0x018"
"106","0.861292","10.100.102.162","185.15.59.224","TCP","54","58383  >  443 [ACK] Seq=3469 Ack=79339 Win=130816 Len=0","","0x010"
"107","0.863245","185.15.59.224","10.100.102.162","TCP","1506","443  >  58383 [ACK] Seq=79339 Ack=3469 Win=42496 Len=1452 [TCP PDU reassembled in 113]","","0x010"
"108","0.863245","185.15.59.224","10.100.102.162","TCP","1506","443  >  58383 [PSH, ACK] Seq=80791 Ack=3469 Win=42496 Len=1452 [TCP PDU reassembled in 113]","","0x018"
"109","0.863285","10.100.102.162","185.15.59.224","TCP","54","58383  >  443 [ACK] Seq=3469 Ack=82243 Win=130816 Len=0","","0x010"
"110","0.868273","185.15.59.224","10.100.102.162","TCP","1506","443  >  58383 [ACK] Seq=82243 Ack=3469 Win=42496 Len=1452 [TCP PDU reassembled in 113]","","0x010"
"111","0.868273","185.15.59.224","10.100.102.162","TCP","1506","443  >  58383 [PSH, ACK] Seq=83695 Ack=3469 Win=42496 Len=1452 [TCP PDU reassembled in 113]","","0x018"
"112","0.868405","10.100.102.162","185.15.59.224","TCP","54","58383  >  443 [ACK] Seq=3469 Ack=85147 Win=130816 Len=0","","0x010"
"113","0.868560","185.15.59.224","10.100.102.162","TLSv1.3","1506","Application Data","","0x010"
"114","0.868810","185.15.59.224","10.100.102.162","TCP","1506","443  >  58383 [PSH, ACK] Seq=86599 Ack=3469 Win=42496 Len=1452 [TCP PDU reassembled in 129]","","0x018"
"115","0.868875","10.100.102.162","185.15.59.224","TCP","54","58383  >  443 [ACK] Seq=3469 Ack=88051 Win=130816 Len=0","","0x010"
"116","0.869787","185.15.59.224","10.100.102.162","TCP","1506","443  >  58383 [ACK] Seq=88051 Ack=3469 Win=42496 Len=1452 [TCP PDU reassembled in 129]","","0x010"
"117","0.869787","185.15.59.224","10.100.102.162","TCP","1506","443  >  58383 [PSH, ACK] Seq=89503 Ack=3469 Win=42496 Len=1452 [TCP PDU reassembled in 129]","","0x018"
"118","0.869844","10.100.102.162","185.15.59.224","TCP","54","58383  >  443 [ACK] Seq=3469 Ack=90955 Win=130816 Len=0","","0x010"
"119","0.870814","185.15.59.224","10.100.102.162","TCP","1506","443  >  58383 [ACK] Seq=90955 Ack=3469 Win=42496 Len=1452 [TCP PDU reassembled in 129]","","0x010"
"120","0.871282","185.15.59.224","10.100.102.162","TCP","1506","443  >  58383 [PSH, ACK] Seq=92407 Ack=3469 Win=42496 Len=1452 [TCP PDU reassembled in 129]","","0x018"
"121","0.871311","10.100.102.162","185.15.59.224","TCP","54","58383  >  443 [ACK] Seq=3469 Ack=93859 Win=130816 Len=0","","0x010"
"122","0.873447","185.15.59.224","10.100.102.162","TCP","1506","443  >  58383 [ACK] Seq=93859 Ack=3469 Win=42496 Len=1452 [TCP PDU reassembled in 129]","","0x010"
"123","0.874005","185.15.59.224","10.100.102.162","TCP","1506","443  >  58383 [PSH, ACK] Seq=95311 Ack=3469 Win=42496 Len=1452 [TCP PDU reassembled in 129]","","0x018"
"124","0.874038","10.100.102.162","185.15.59.224","TCP","54","58383  >  443 [ACK] Seq=3469 Ack=96763 Win=130816 Len=0","","0x010"
"125","0.874568","185.15.59.224","10.100.102.162","TCP","1506","443  >  58383 [ACK] Seq=96763 Ack=3469 Win=42496 Len=1452 [TCP PDU reassembled in 129]","","0x010"
"126","0.875073","185.15.59.224","10.100.102.162","TCP","1506","443  >  58383 [PSH, ACK] Seq=98215 Ack=3469 Win=42496 Len=1452 [TCP PDU reassembled in 129]","","0x018"
"127","0.875090","10.100.102.162","185.15.59.224","TCP","54","58383  >  443 [ACK] Seq=3469 Ack=99667 Win=130816 Len=0","","0x010"
"128","0.875524","185.15.59.224","10.100.102.162","TCP","1506","443  >  58383 [ACK] Seq=99667 Ack=3469 Win=42496 Len=1452 [TCP PDU reassembled in 129]","","0x010"
"129","0.875524","185.15.59.224","10.100.102.162","TLSv1.3","1506","Application Data","","0x018"
"130","0.875547","10.100.102.162","185.15.59.224","TCP","54","58383  >  443 [ACK] Seq=3469 Ack=102571 Win=130816 Len=0","","0x010"
"131","0.879271","185.15.59.224","10.100.102.162","TCP","1506","443  >  58383 [ACK] Seq=102571 Ack=3469 Win=42496 Len=1452 [TCP PDU reassembled in 146]","","0x010"
"132","0.879271","185.15.59.224","10.100.102.162","TCP","1506","443  >  58383 [PSH, ACK] Seq=104023 Ack=3469 Win=42496 Len=1452 [TCP PDU reassembled in 146]","","0x018"
"133","0.879348","10.100.102.162","185.15.59.224","TCP","54","58383  >  443 [ACK] Seq=3469 Ack=105475 Win=130816 Len=0","","0x010"
"134","0.879845","185.15.59.224","10.100.102.162","TCP","1506","443  >  58383 [ACK] Seq=105475 Ack=3469 Win=42496 Len=1452 [TCP PDU reassembled in 146]","","0x010"
"135","0.879845","185.15.59.224","10.100.102.162","TCP","1506","443  >  58383 [PSH, ACK] Seq=106927 Ack=3469 Win=42496 Len=1452 [TCP PDU reassembled in 146]","","0x018"
"136","0.879995","10.100.102.162","185.15.59.224","TCP","54","58383  >  443 [ACK] Seq=3469 Ack=108379 Win=130816 Len=0","","0x010"
"137","0.881795","185.15.59.224","10.100.102.162","TCP","1506","443  >  58383 [ACK] Seq=108379 Ack=3469 Win=42496 Len=1452 [TCP PDU reassembled in 146]","","0x010"
"138","0.881795","185.15.59.224","10.100.102.162","TCP","1506","443  >  58383 [PSH, ACK] Seq=109831 Ack=3469 Win=42496 Len=1452 [TCP PDU reassembled in 146]","","0x018"
"139","0.881902","10.100.102.162","185.15.59.224","TCP","54","58383  >  443 [ACK] Seq=3469 Ack=111283 Win=130816 Len=0","","0x010"
"140","0.882282","185.15.59.224","10.100.102.162","TCP","1506","443  >  58383 [ACK] Seq=111283 Ack=3469 Win=42496 Len=1452 [TCP PDU reassembled in 146]","","0x010"
"141","0.882824","185.15.59.224","10.100.102.162","TCP","1506","443  >  58383 [PSH, ACK] Seq=112735 Ack=3469 Win=42496 Len=1452 [TCP PDU reassembled in 146]","","0x018"
"142","0.882870","10.100.102.162","185.15.59.224","TCP","54","58383  >  443 [ACK] Seq=3469 Ack=114187 Win=130816 Len=0","","0x010"
"143","0.884601","185.15.59.224","10.100.102.162","TCP","1506","443  >  58383 [ACK] Seq=114187 Ack=3469 Win=42496 Len=1452 [TCP PDU reassembled in 146]","","0x010"
"144","0.884601","185.15.59.224","10.100.102.162","TCP","1506","443  >  58383 [PSH, ACK] Seq=115639 Ack=3469 Win=42496 Len=1452 [TCP PDU reassembled in 146]","","0x018"
"145","0.884654","10.100.102.162","185.15.59.224","TCP","54","58383  >  443 [ACK] Seq=3469 Ack=117091 Win=130816 Len=0","","0x010"
"146","0.885892","185.15.59.224","10.100.102.162","TLSv1.3","1506","Application Data","","0x010"
"147","0.885892","185.15.59.224","10.100.102.162","TCP","1506","443  >  58383 [PSH, ACK] Seq=118543 Ack=3469 Win=42496 Len=1452 [TCP PDU reassembled in 162]","","0x018"
"148","0.885950","10.100.102.162","185.15.59.224","TCP","54","58383  >  443 [ACK] Seq=3469 Ack=119995 Win=130816 Len=0","","0x010"
"149","0.888021","185.15.59.224","10.100.102.162","TCP","1506","443  >  58383 [ACK] Seq=119995 Ack=3469 Win=42496 Len=1452 [TCP PDU reassembled in 162]","","0x010"
"150","0.888021","185.15.59.224","10.100.102.162","TCP","1506","443  >  58383 [PSH, ACK] Seq=121447 Ack=3469 Win=42496 Len=1452 [TCP PDU reassembled in 162]","","0x018"
"151","0.888085","10.100.102.162","185.15.59.224","TCP","54","58383  >  443 [ACK] Seq=3469 Ack=122899 Win=130816 Len=0","","0x010"
"152","0.889396","185.15.59.224","10.100.102.162","TCP","1506","443  >  58383 [ACK] Seq=122899 Ack=3469 Win=42496 Len=1452 [TCP PDU reassembled in 162]","","0x010"
"153","0.889396","185.15.59.224","10.100.102.162","TCP","1506","443  >  58383 [PSH, ACK] Seq=124351 Ack=3469 Win=42496 Len=1452 [TCP PDU reassembled in 162]","","0x018"
"154","0.889433","10.100.102.162","185.15.59.224","TCP","54","58383  >  443 [ACK] Seq=3469 Ack=125803 Win=130816 Len=0","","0x010"
"155","0.891082","185.15.59.224","10.100.102.162","TCP","1506","443  >  58383 [ACK] Seq=125803 Ack=3469 Win=42496 Len=1452 [TCP PDU reassembled in 162]","","0x010"
"156","0.891082","185.15.59.224","10.100.102.162","TCP","1506","443  >  58383 [PSH, ACK] Seq=127255 Ack=3469 Win=42496 Len=1452 [TCP PDU reassembled in 162]","","0x018"
"157","0.891120","10.100.102.162","185.15.59.224","TCP","54","58383  >  443 [ACK] Seq=3469 Ack=128707 Win=130816 Len=0","","0x010"
"158","0.892764","185.15.59.224","10.100.102.162","TCP","1506","443  >  58383 [ACK] Seq=128707 Ack=3469 Win=42496 Len=1452 [TCP PDU reassembled in 162]","","0x010"
"159","0.893149","185.15.59.224","10.100.102.162","TCP","1506","443  >  58383 [PSH, ACK] Seq=130159 Ack=3469 Win=42496 Len=1452 [TCP PDU reassembled in 162]","","0x018"
"160","0.893178","10.100.102.162","185.15.59.224","TCP","54","58383  >  443 [ACK] Seq=3469 Ack=131611 Win=130816 Len=0","","0x010"
"161","0.894308","185.15.59.224","10.100.102.162","TCP","1506","443  >  58383 [ACK] Seq=131611 Ack=3469 Win=42496 Len=1452 [TCP PDU reassembled in 162]","","0x010"
"162","0.894308","185.15.59.224","10.100.102.162","TLSv1.3","1506","Application Data","","0x018"
"163","0.894349","10.100.102.162","185.15.59.224","TCP","54","58383  >  443 [ACK] Seq=3469 Ack=134515 Win=130816 Len=0","","0x010"
"164","0.895795","185.15.59.224","10.100.102.162","TCP","1506","443  >  58383 [ACK] Seq=134515 Ack=3469 Win=42496 Len=1452 [TCP PDU reassembled in 180]","","0x010"
"165","0.896595","185.15.59.224","10.100.102.162","TCP","1506","443  >  58383 [PSH, ACK] Seq=135967 Ack=3469 Win=42496 Len=1452 [TCP PDU reassembled in 180]","","0x018"
"166","0.896641","10.100.102.162","185.15.59.224","TCP","54","58383  >  443 [ACK] Seq=3469 Ack=137419 Win=130816 Len=0","","0x010"
"167","0.897371","185.15.59.224","10.100.102.162","TCP","1506","443  >  58383 [ACK] Seq=137419 Ack=3469 Win=42496 Len=1452 [TCP PDU reassembled in 180]","","0x010"
"168","0.897371","185.15.59.224","10.100.102.162","TCP","1506","443  >  58383 [PSH, ACK] Seq=138871 Ack=3469 Win=42496 Len=1452 [TCP PDU reassembled in 180]","","0x018"
"169","0.897412","10.100.102.162","185.15.59.224","TCP","54","58383  >  443 [ACK] Seq=3469 Ack=140323 Win=130816 Len=0","","0x010"
"170","0.901273","185.15.59.224","10.100.102.162","TCP","1506","443  >  58383 [ACK] Seq=140323 Ack=3469 Win=42496 Len=1452 [TCP PDU reassembled in 180]","","0x010"
"171","0.901273","185.15.59.224","10.100.102.162","TCP","1506","443  >  58383 [PSH, ACK] Seq=141775 Ack=3469 Win=42496 Len=1452 [TCP PDU reassembled in 180]","","0x018"
"172","0.901369","10.100.102.162","185.15.59.224","TCP","54","58383  >  443 [ACK] Seq=3469 Ack=143227 Win=130816 Len=0","","0x010"
"173","0.901877","185.15.59.224","10.100.102.162","TCP","1506","443  >  58383 [ACK] Seq=143227 Ack=3469 Win=42496 Len=1452 [TCP PDU reassembled in 180]","","0x010"
"174","0.902392","185.15.59.224","10.100.102.162","TCP","1506","443  >  58383 [PSH, ACK] Seq=144679 Ack=3469 Win=42496 Len=1452 [TCP PDU reassembled in 180]","","0x018"
"175","0.902582","10.100.102.162","185.15.59.224","TCP","54","58383  >  443 [ACK] Seq=3469 Ack=146131 Win=130816 Len=0","","0x010"
"176","0.903202","185.15.59.224","10.100.102.162","TCP","1506","443  >  58383 [ACK] Seq=146131 Ack=3469 Win=42496 Len=1452 [TCP PDU reassembled in 180]","","0x010"
"177","0.903688","185.15.59.224","10.100.102.162","TCP","1506","443  >  58383 [PSH, ACK] Seq=147583 Ack=3469 Win=42496 Len=1452 [TCP PDU reassembled in 180]","","0x018"
"178","0.903720","10.100.102.162","185.15.59.224","TCP","54","58383  >  443 [ACK] Seq=3469 Ack=149035 Win=130816 Len=0","","0x010"
"179","0.913404","185.15.59.224","10.100.102.162","TCP","1506","443  >  58383 [ACK] Seq=149035 Ack=3469 Win=42496 Len=1452 [TCP PDU reassembled in 180]","","0x010"
"180","0.913404","185.15.59.224","10.100.102.162","TLSv1.3","1506","Application Data","","0x018"
"181","0.913503","10.100.102.162","185.15.59.224","TCP","54","58383  >  443 [ACK] Seq=3469 Ack=151939 Win=130816 Len=0","","0x010"
"182","0.914738","185.15.59.224","10.100.102.162","TCP","1506","443  >  58383 [ACK] Seq=151939 Ack=3469 Win=42496 Len=1452 [TCP PDU reassembled in 197]","","0x010"
"183","0.914738","185.15.59.224","10.100.102.162","TCP","1506","443  >  58383 [PSH, ACK] Seq=153391 Ack=3469 Win=42496 Len=1452 [TCP PDU reassembled in 197]","","0x018"
"184","0.914797","10.100.102.162","185.15.59.224","TCP","54","58383  >  443 [ACK] Seq=3469 Ack=154843 Win=130816 Len=0","","0x010"
"185","0.915271","185.15.59.224","10.100.102.162","TCP","1506","443  >  58383 [ACK] Seq=154843 Ack=3469 Win=42496 Len=1452 [TCP PDU reassembled in 197]","","0x010"
"186","0.915271","185.15.59.224","10.100.102.162","TCP","1506","443  >  58383 [PSH, ACK] Seq=156295 Ack=3469 Win=42496 Len=1452 [TCP PDU reassembled in 197]","","0x018"
"187","0.915339","10.100.102.162","185.15.59.224","TCP","54","58383  >  443 [ACK] Seq=3469 Ack=157747 Win=130816 Len=0","","0x010"
"188","0.916273","185.15.59.224","10.100.102.162","TCP","1506","443  >  58383 [ACK] Seq=157747 Ack=3469 Win=42496 Len=1452 [TCP PDU reassembled in 197]","","0x010"
"189","0.916273","185.15.59.224","10.100.102.162","TCP","1506","443  >  58383 [PSH, ACK] Seq=159199 Ack=3469 Win=42496 Len=1452 [TCP PDU reassembled in 197]","","0x018"
"190","0.916351","10.100.102.162","185.15.59.224","TCP","54","58383  >  443 [ACK] Seq=3469 Ack=160651 Win=130816 Len=0","","0x010"
"191","0.928622","185.15.59.224","10.100.102.162","TCP","1506","443  >  58383 [ACK] Seq=160651 Ack=3469 Win=42496 Len=1452 [TCP PDU reassembled in 197]","","0x010"
"192","0.929719","185.15.59.224","10.100.102.162","TCP","1506","443  >  58383 [PSH, ACK] Seq=162103 Ack=3469 Win=42496 Len=1452 [TCP PDU reassembled in 197]","","0x018"
"193","0.929719","185.15.59.224","10.100.102.162","TCP","1506","443  >  58383 [ACK] Seq=163555 Ack=3469 Win=42496 Len=1452 [TCP PDU reassembled in 197]","","0x010"
"194","0.929833","10.100.102.162","185.15.59.224","TCP","54","58383  >  443 [ACK] Seq=3469 Ack=165007 Win=130816 Len=0","","0x010"
"195","0.930183","185.15.59.224","10.100.102.162","TCP","1506","443  >  58383 [PSH, ACK] Seq=165007 Ack=3469 Win=42496 Len=1452 [TCP PDU reassembled in 197]","","0x018"
"196","0.930246","10.100.102.162","185.15.59.224","TCP","54","58383  >  443 [ACK] Seq=3469 Ack=166459 Win=130816 Len=0","","0x010"
"197","0.932399","185.15.59.224","10.100.102.162","TLSv1.3","1506","Application Data","","0x010"
"198","0.932399","185.15.59.224","10.100.102.162","TCP","1506","443  >  58383 [PSH, ACK] Seq=167911 Ack=3469 Win=42496 Len=1452 [TCP PDU reassembled in 213]","","0x018"
"199","0.932497","10.100.102.162","185.15.59.224","TCP","54","58383  >  443 [ACK] Seq=3469 Ack=169363 Win=130816 Len=0","","0x010"
"200","0.932697","185.15.59.224","10.100.102.162","TCP","1506","443  >  58383 [ACK] Seq=169363 Ack=3469 Win=42496 Len=1452 [TCP PDU reassembled in 213]","","0x010"
"201","0.933124","185.15.59.224","10.100.102.162","TCP","1506","443  >  58383 [PSH, ACK] Seq=170815 Ack=3469 Win=42496 Len=1452 [TCP PDU reassembled in 213]","","0x018"
"202","0.933168","10.100.102.162","185.15.59.224","TCP","54","58383  >  443 [ACK] Seq=3469 Ack=172267 Win=130816 Len=0","","0x010"
"203","0.935087","185.15.59.224","10.100.102.162","TCP","1506","443  >  58383 [ACK] Seq=172267 Ack=3469 Win=42496 Len=1452 [TCP PDU reassembled in 213]","","0x010"
"204","0.935087","185.15.59.224","10.100.102.162","TCP","1506","443  >  58383 [PSH, ACK] Seq=173719 Ack=3469 Win=42496 Len=1452 [TCP PDU reassembled in 213]","","0x018"
"205","0.935198","10.100.102.162","185.15.59.224","TCP","54","58383  >  443 [ACK] Seq=3469 Ack=175171 Win=130816 Len=0","","0x010"
"206","0.936676","185.15.59.224","10.100.102.162","TCP","1506","443  >  58383 [ACK] Seq=175171 Ack=3469 Win=42496 Len=1452 [TCP PDU reassembled in 213]","","0x010"
"207","0.936676","185.15.59.224","10.100.102.162","TCP","1506","443  >  58383 [PSH, ACK] Seq=176623 Ack=3469 Win=42496 Len=1452 [TCP PDU reassembled in 213]","","0x018"
"208","0.936764","10.100.102.162","185.15.59.224","TCP","54","58383  >  443 [ACK] Seq=3469 Ack=178075 Win=130816 Len=0","","0x010"
"209","0.938391","185.15.59.224","10.100.102.162","TCP","1506","443  >  58383 [ACK] Seq=178075 Ack=3469 Win=42496 Len=1452 [TCP PDU reassembled in 213]","","0x010"
"210","0.938391","185.15.59.224","10.100.102.162","TCP","1506","443  >  58383 [PSH, ACK] Seq=179527 Ack=3469 Win=42496 Len=1452 [TCP PDU reassembled in 213]","","0x018"
"211","0.938488","10.100.102.162","185.15.59.224","TCP","54","58383  >  443 [ACK] Seq=3469 Ack=180979 Win=130816 Len=0","","0x010"
"212","0.940384","185.15.59.224","10.100.102.162","TCP","1506","443  >  58383 [ACK] Seq=180979 Ack=3469 Win=42496 Len=1452 [TCP PDU reassembled in 213]","","0x010"
"213","0.940384","185.15.59.224","10.100.102.162","TLSv1.3","1506","Application Data","","0x018"
"214","0.940515","10.100.102.162","185.15.59.224","TCP","54","58383  >  443 [ACK] Seq=3469 Ack=183883 Win=130816 Len=0","","0x010"
"215","0.942851","185.15.59.224","10.100.102.162","TCP","1506","443  >  58383 [ACK] Seq=183883 Ack=3469 Win=42496 Len=1452 [TCP PDU reassembled in 222]","","0x010"
"216","0.942851","185.15.59.224","10.100.102.162","TCP","1506","443  >  58383 [PSH, ACK] Seq=185335 Ack=3469 Win=42496 Len=1452 [TCP PDU reassembled in 222]","","0x018"
"217","0.942851","185.15.59.224","10.100.102.162","TCP","1506","443  >  58383 [ACK] Seq=186787 Ack=3469 Win=42496 Len=1452 [TCP PDU reassembled in 222]","","0x010"
"218","0.942956","10.100.102.162","185.15.59.224","TCP","54","58383  >  443 [ACK] Seq=3469 Ack=188239 Win=130816 Len=0","","0x010"
"219","0.943385","185.15.59.224","10.100.102.162","TCP","1506","443  >  58383 [PSH, ACK] Seq=188239 Ack=3469 Win=42496 Len=1452 [TCP PDU reassembled in 222]","","0x018"
"220","0.943451","10.100.102.162","185.15.59.224","TCP","54","58383  >  443 [ACK] Seq=3469 Ack=189691 Win=130816 Len=0","","0x010"
"221","0.945074","185.15.59.224","10.100.102.162","TCP","1506","443  >  58383 [ACK] Seq=189691 Ack=3469 Win=42496 Len=1452 [TCP PDU reassembled in 222]","","0x010"
"222","0.945074","185.15.59.224","10.100.102.162","TLSv1.3","695","Application Data","","0x018"
"223","0.945153","10.100.102.162","185.15.59.224","TCP","54","58383  >  443 [ACK] Seq=3469 Ack=191784 Win=130816 Len=0","","0x010"
"224","0.975539","10.100.102.162","185.15.59.224","TLSv1.3","165","Application Data","","0x018"
"225","0.975620","10.100.102.162","185.15.59.224","TLSv1.3","165","Application Data","","0x018"
"226","0.975656","10.100.102.162","185.15.59.224","TLSv1.3","164","Application Data","","0x018"
"227","0.977077","10.100.102.162","185.15.59.224","TLSv1.3","163","Application Data","","0x018"
"228","1.044499","185.15.59.224","10.100.102.162","TCP","56","443  >  58383 [ACK] Seq=191784 Ack=3910 Win=42496 Len=0","","0x010"
"229","1.044499","185.15.59.224","10.100.102.162","TLSv1.3","1463","Application Data","","0x018"
"230","1.044881","185.15.59.224","10.100.102.162","TCP","1506","443  >  58383 [ACK] Seq=193193 Ack=3910 Win=42496 Len=1452 [TCP PDU reassembled in 231]","","0x010"
"231","1.044881","185.15.59.224","10.100.102.162","TLSv1.3","302","Application Data","","0x018"
"232","1.044923","10.100.102.162","185.15.59.224","TCP","54","58383  >  443 [ACK] Seq=3910 Ack=194893 Win=130816 Len=0","","0x010"
"233","1.045181","185.15.59.224","10.100.102.162","TLSv1.3","1162","Application Data","","0x018"
"234","1.045181","185.15.59.224","10.100.102.162","TCP","1506","443  >  58383 [ACK] Seq=196001 Ack=3910 Win=42496 Len=1452 [TCP PDU reassembled in 236]","","0x010"
"235","1.045222","10.100.102.162","185.15.59.224","TCP","54","58383  >  443 [ACK] Seq=3910 Ack=197453 Win=130816 Len=0","","0x010"
"236","1.045512","185.15.59.224","10.100.102.162","TLSv1.3","1071","Application Data","","0x018"
"237","1.045546","10.100.102.162","185.15.59.224","TCP","54","58383  >  443 [ACK] Seq=3910 Ack=198470 Win=130048 Len=0","","0x010"
"238","1.089418","10.100.102.162","185.15.59.224","TLSv1.3","292","Application Data","","0x018"
"239","1.203313","185.15.59.224","10.100.102.162","TCP","56","443  >  58383 [ACK] Seq=198470 Ack=4148 Win=42496 Len=0","","0x010"
"240","1.283707","185.15.59.224","10.100.102.162","TLSv1.3","867","Application Data","","0x018"
"241","1.283707","185.15.59.224","10.100.102.162","TCP","1506","443  >  58383 [ACK] Seq=199283 Ack=4148 Win=42496 Len=1452 [TCP PDU reassembled in 242]","","0x010"
"242","1.283707","185.15.59.224","10.100.102.162","TLSv1.3","682","Application Data","","0x018"
"243","1.283754","10.100.102.162","185.15.59.224","TCP","54","58383  >  443 [ACK] Seq=4148 Ack=201363 Win=130816 Len=0","","0x010"
"244","1.284007","185.15.59.224","10.100.102.162","TLSv1.3","85","Application Data","","0x018"
"245","1.284018","10.100.102.162","185.15.59.224","TCP","54","58383  >  443 [ACK] Seq=4148 Ack=201394 Win=130816 Len=0","","0x010"
"246","1.844809","10.100.102.162","185.15.59.224","TLSv1.3","245","Application Data","","0x018"
"247","1.844887","10.100.102.162","185.15.59.224","TLSv1.3","380","Application Data","","0x018"
"248","1.932816","185.15.59.224","10.100.102.162","TCP","56","443  >  58383 [ACK] Seq=201394 Ack=4339 Win=42496 Len=0","","0x010"
"249","1.932816","185.15.59.224","10.100.102.162","TCP","56","443  >  58383 [ACK] Seq=201394 Ack=4665 Win=42496 Len=0","","0x010"
"250","1.932816","185.15.59.224","10.100.102.162","TLSv1.3","102","Application Data","","0x018"
"251","1.981546","10.100.102.162","185.15.59.224","TCP","54","58383  >  443 [ACK] Seq=4665 Ack=201442 Win=130816 Len=0","","0x010"
"252","1.995522","185.15.59.224","10.100.102.162","TLSv1.3","891","Application Data","","0x018"
"253","2.048780","10.100.102.162","185.15.59.224","TCP","54","58383  >  443 [ACK] Seq=4665 Ack=202279 Win=130048 Len=0","","0x010"
