"No.","Time","Source","Destination","Protocol","Length","Info","TLS server name","Flags"
"1","0.000000","52.182.143.212","10.9.14.244","TCP","74","443  >  62464 [SYN, ACK] Seq=0 Ack=1 Win=65535 Len=0 MSS=1380 WS=256 SACK_PERM TSval=723277212 TSecr=145623406","","0x012"
"2","0.000073","10.9.14.244","52.182.143.212","TCP","66","62464  >  443 [ACK] Seq=1 Ack=1 Win=10 Len=0 TSval=145623581 TSecr=723277212","","0x010"
"3","0.000877","10.9.14.244","52.182.143.212","TLSv1.2","281","Client Hello (SNI=watson.events.data.microsoft.com)","watson.events.data.microsoft.com","0x018"
"4","0.182572","52.182.143.212","10.9.14.244","TCP","1434","443  >  62464 [ACK] Seq=1 Ack=216 Win=4195328 Len=1368 TSval=723277394 TSecr=145623582 [TCP PDU reassembled in 8]","","0x010"
"5","0.229802","10.9.14.244","52.182.143.212","TCP","66","62464  >  443 [ACK] Seq=216 Ack=1369 Win=16 Len=0 TSval=145623811 TSecr=723277394","","0x010"
"6","0.404766","52.182.143.212","10.9.14.244","TCP","1434","443  >  62464 [ACK] Seq=1369 Ack=216 Win=4195328 Len=1368 TSval=723277617 TSecr=145623811 [TCP PDU reassembled in 8]","","0x010"
"7","0.404766","52.182.143.212","10.9.14.244","TCP","1434","443  >  62464 [ACK] Seq=2737 Ack=216 Win=4195328 Len=1368 TSval=723277617 TSecr=145623811 [TCP PDU reassembled in 8]","","0x010"
"8","0.404766","52.182.143.212","10.9.14.244","TLSv1.2","488","Server Hello, Certificate, Server Key Exchange, Server Hello Done","","0x018"
"9","0.404889","10.9.14.244","52.182.143.212","TCP","66","62464  >  443 [ACK] Seq=216 Ack=4527 Win=28 Len=0 TSval=145623986 TSecr=723277617","","0x010"
"10","0.412612","10.9.14.244","52.182.143.212","TLSv1.2","224","Client Key Exchange, Change Cipher Spec, Encrypted Handshake Message","","0x018"
"11","0.588686","52.182.143.212","10.9.14.244","TLSv1.2","117","Change Cipher Spec, Encrypted Handshake Message","","0x018"
"12","0.588686","52.182.143.212","10.9.14.244","TLSv1.2","135","Application Data","","0x018"
"13","0.588719","10.9.14.244","52.182.143.212","TCP","66","62464  >  443 [ACK] Seq=374 Ack=4647 Win=28 Len=0 TSval=145624170 TSecr=723277801","","0x010"
"14","0.596993","10.9.14.244","52.182.143.212","TLSv1.2","153","Application Data","","0x018"
"15","0.597347","10.9.14.244","52.182.143.212","TLSv1.2","1170","Application Data","","0x018"
"16","0.600379","10.9.14.244","52.182.143.212","TLSv1.2","104","Application Data","","0x018"
"17","0.600839","10.9.14.244","52.182.143.212","TCP","1434","62464  >  443 [ACK] Seq=1603 Ack=4647 Win=28 Len=1368 TSval=145624182 TSecr=723277801 [TCP PDU reassembled in 25]","","0x010"
"18","0.774013","52.182.143.212","10.9.14.244","TLSv1.2","104","Application Data","","0x018"
"19","0.774053","10.9.14.244","52.182.143.212","TCP","66","62464  >  443 [ACK] Seq=2971 Ack=4685 Win=29 Len=0 TSval=145624355 TSecr=723277986","","0x010"
"20","0.774684","52.182.143.212","10.9.14.244","TCP","66","443  >  62464 [ACK] Seq=4685 Ack=1565 Win=4195584 Len=0 TSval=723277987 TSecr=145624179","","0x010"
"21","0.774684","52.182.143.212","10.9.14.244","TCP","66","443  >  62464 [ACK] Seq=4685 Ack=1603 Win=4195584 Len=0 TSval=723277987 TSecr=145624182","","0x010"
"22","0.774684","52.182.143.212","10.9.14.244","TCP","66","443  >  62464 [ACK] Seq=4685 Ack=2971 Win=4195584 Len=0 TSval=723277987 TSecr=145624182","","0x010"
"23","0.774711","10.9.14.244","52.182.143.212","TCP","1434","62464  >  443 [ACK] Seq=2971 Ack=4685 Win=29 Len=1368 TSval=145624356 TSecr=723277987 [TCP PDU reassembled in 25]","","0x010"
"24","0.774711","10.9.14.244","52.182.143.212","TCP","1434","62464  >  443 [ACK] Seq=4339 Ack=4685 Win=29 Len=1368 TSval=145624356 TSecr=723277987 [TCP PDU reassembled in 25]","","0x010"
"25","0.774711","10.9.14.244","52.182.143.212","TLSv1.2","1434","Application Data","","0x018"
"26","0.950009","52.182.143.212","10.9.14.244","TCP","66","443  >  62464 [ACK] Seq=4685 Ack=5707 Win=4195584 Len=0 TSval=723278162 TSecr=145624356","","0x010"
"27","0.950065","10.9.14.244","52.182.143.212","TLSv1.2","930","Application Data","","0x018"
"28","1.002954","52.182.143.212","10.9.14.244","TCP","66","443  >  62464 [ACK] Seq=4685 Ack=7075 Win=4195584 Len=0 TSval=723278215 TSecr=145624356","","0x010"
"29","1.126558","52.182.143.212","10.9.14.244","TLSv1.2","245","Application Data","","0x018"
"30","1.127788","10.9.14.244","52.182.143.212","TCP","66","62464  >  443 [FIN, ACK] Seq=7939 Ack=4864 Win=29 Len=0 TSval=145624709 TSecr=723278337","","0x011"
"31","1.284239","10.9.14.244","52.182.143.212","TCP","74","62465  >  443 [SYN] Seq=0 Win=65535 Len=0 MSS=1460 WS=256 SACK_PERM TSval=145624866 TSecr=0","","0x002"
"32","1.302976","52.182.143.212","10.9.14.244","TCP","66","443  >  62464 [FIN, ACK] Seq=4864 Ack=7940 Win=4194560 Len=0 TSval=723278514 TSecr=145624709","","0x011"
"33","1.303072","10.9.14.244","52.182.143.212","TCP","66","62464  >  443 [ACK] Seq=7940 Ack=4865 Win=29 Len=0 TSval=145624884 TSecr=723278514","","0x010"
"34","1.473854","52.182.143.212","10.9.14.244","TCP","74","443  >  62465 [SYN, ACK] Seq=0 Ack=1 Win=65535 Len=0 MSS=1380 WS=256 SACK_PERM TSval=722118997 TSecr=145624866","","0x012"
"35","1.473937","10.9.14.244","52.182.143.212","TCP","66","62465  >  443 [ACK] Seq=1 Ack=1 Win=2560 Len=0 TSval=145625055 TSecr=722118997","","0x010"
"36","1.476087","10.9.14.244","52.182.143.212","TLSv1.2","281","Client Hello (SNI=watson.events.data.microsoft.com)","watson.events.data.microsoft.com","0x018"
"37","1.664523","52.182.143.212","10.9.14.244","TCP","1434","443  >  62465 [ACK] Seq=1 Ack=216 Win=4195328 Len=1368 TSval=722119188 TSecr=145625057 [TCP PDU reassembled in 41]","","0x010"
"38","1.706417","10.9.14.244","52.182.143.212","TCP","66","62465  >  443 [ACK] Seq=216 Ack=1369 Win=4096 Len=0 TSval=145625288 TSecr=722119188","","0x010"
"39","1.893219","52.182.143.212","10.9.14.244","TCP","1434","443  >  62465 [ACK] Seq=1369 Ack=216 Win=4195328 Len=1368 TSval=722119419 TSecr=145625288 [TCP PDU reassembled in 41]","","0x010"
"40","1.893219","52.182.143.212","10.9.14.244","TCP","1434","443  >  62465 [ACK] Seq=2737 Ack=216 Win=4195328 Len=1368 TSval=722119419 TSecr=145625288 [TCP PDU reassembled in 41]","","0x010"
"41","1.893219","52.182.143.212","10.9.14.244","TLSv1.2","488","Server Hello, Certificate, Server Key Exchange, Server Hello Done","","0x018"
"42","1.893335","10.9.14.244","52.182.143.212","TCP","66","62465  >  443 [ACK] Seq=216 Ack=4527 Win=7168 Len=0 TSval=145625475 TSecr=722119419","","0x010"
"43","1.896413","10.9.14.244","52.182.143.212","TLSv1.2","224","Client Key Exchange, Change Cipher Spec, Encrypted Handshake Message","","0x018"
"44","2.087485","52.182.143.212","10.9.14.244","TLSv1.2","117","Change Cipher Spec, Encrypted Handshake Message","","0x018"
"45","2.087485","52.182.143.212","10.9.14.244","TLSv1.2","135","Application Data","","0x018"
"46","2.087563","10.9.14.244","52.182.143.212","TCP","66","62465  >  443 [ACK] Seq=374 Ack=4647 Win=7168 Len=0 TSval=145625669 TSecr=722119612","","0x010"
"47","2.090371","10.9.14.244","52.182.143.212","TLSv1.2","153","Application Data","","0x018"
"48","2.090494","10.9.14.244","52.182.143.212","TLSv1.2","1170","Application Data","","0x018"
"49","2.090603","10.9.14.244","52.182.143.212","TLSv1.2","104","Application Data","","0x018"
"50","2.093209","10.9.14.244","52.182.143.212","TCP","1434","62465  >  443 [ACK] Seq=1603 Ack=4647 Win=7168 Len=1368 TSval=145625675 TSecr=722119612 [TCP PDU reassembled in 73]","","0x010"
"51","2.108522","10.9.14.244","142.250.180.163","TCP","66","62466  >  443 [SYN] Seq=0 Win=65535 Len=0 MSS=1460 WS=256 SACK_PERM","","0x002"
"52","2.161890","142.250.180.163","10.9.14.244","TCP","66","443  >  62466 [SYN, ACK] Seq=0 Ack=1 Win=65535 Len=0 MSS=1380 SACK_PERM WS=256","","0x012"
"53","2.161985","10.9.14.244","142.250.180.163","TCP","54","62466  >  443 [ACK] Seq=1 Ack=1 Win=65280 Len=0","","0x010"
"54","2.162968","10.9.14.244","142.250.180.163","TCP","1434","62466  >  443 [ACK] Seq=1 Ack=1 Win=65280 Len=1380 [TCP PDU reassembled in 55]","","0x010"
"55","2.162968","10.9.14.244","142.250.180.163","TLSv1.3","445","Client Hello (SNI=clientservices.googleapis.com)","clientservices.googleapis.com","0x018"
"56","2.217364","142.250.180.163","10.9.14.244","TCP","56","443  >  62466 [ACK] Seq=1 Ack=1381 Win=268544 Len=0","","0x010"
"57","2.217364","142.250.180.163","10.9.14.244","TCP","56","443  >  62466 [ACK] Seq=1 Ack=1772 Win=268288 Len=0","","0x010"
"58","2.233320","142.250.180.163","10.9.14.244","TLSv1.3","1434","Server Hello, Change Cipher Spec","","0x010"
"59","2.233320","142.250.180.163","10.9.14.244","TCP","1434","443  >  62466 [PSH, ACK] Seq=1381 Ack=1772 Win=268288 Len=1380 [TCP PDU reassembled in 62]","","0x018"
"60","2.233320","142.250.180.163","10.9.14.244","TCP","1434","443  >  62466 [ACK] Seq=2761 Ack=1772 Win=268288 Len=1380 [TCP PDU reassembled in 62]","","0x010"
"61","2.233320","142.250.180.163","10.9.14.244","TCP","1434","443  >  62466 [PSH, ACK] Seq=4141 Ack=1772 Win=268288 Len=1380 [TCP PDU reassembled in 62]","","0x018"
"62","2.233320","142.250.180.163","10.9.14.244","TLSv1.3","294","Application Data","","0x018"
"63","2.233442","10.9.14.244","142.250.180.163","TCP","54","62466  >  443 [ACK] Seq=1772 Ack=5761 Win=65280 Len=0","","0x010"
"64","2.261919","10.9.14.244","142.250.180.163","TLSv1.3","128","Change Cipher Spec, Application Data","","0x018"
"65","2.262376","10.9.14.244","142.250.180.163","TLSv1.3","146","Application Data","","0x018"
"66","2.262752","10.9.14.244","142.250.180.163","TLSv1.3","402","Application Data","","0x018"
"67","2.276446","52.182.143.212","10.9.14.244","TLSv1.2","104","Application Data","","0x018"
"68","2.276446","52.182.143.212","10.9.14.244","TCP","66","443  >  62465 [ACK] Seq=4685 Ack=1565 Win=4195584 Len=0 TSval=722119803 TSecr=145625672","","0x010"
"69","2.276446","52.182.143.212","10.9.14.244","TCP","66","443  >  62465 [ACK] Seq=4685 Ack=1603 Win=4195584 Len=0 TSval=722119803 TSecr=145625672","","0x010"
"70","2.276554","10.9.14.244","52.182.143.212","TCP","1434","62465  >  443 [ACK] Seq=2971 Ack=4685 Win=7424 Len=1368 TSval=145625858 TSecr=722119800 [TCP PDU reassembled in 73]","","0x010"
"71","2.279970","52.182.143.212","10.9.14.244","TCP","66","443  >  62465 [ACK] Seq=4685 Ack=2971 Win=4195584 Len=0 TSval=722119805 TSecr=145625675","","0x010"
"72","2.280024","10.9.14.244","52.182.143.212","TCP","1434","62465  >  443 [ACK] Seq=4339 Ack=4685 Win=7424 Len=1368 TSval=145625861 TSecr=722119805 [TCP PDU reassembled in 73]","","0x010"
"73","2.280024","10.9.14.244","52.182.143.212","TLSv1.2","1434","Application Data","","0x018"
"74","2.317696","142.250.180.163","10.9.14.244","TLSv1.3","1042","Application Data, Application Data","","0x018"
"75","2.317696","142.250.180.163","10.9.14.244","TLSv1.3","85","Application Data","","0x018"
"76","2.317783","10.9.14.244","142.250.180.163","TCP","54","62466  >  443 [ACK] Seq=2286 Ack=6780 Win=64512 Len=0","","0x010"
"77","2.318096","10.9.14.244","142.250.180.163","TLSv1.3","85","Application Data","","0x018"
"78","2.335732","142.250.180.163","10.9.14.244","TLSv1.3","487","Application Data","","0x018"
"79","2.335732","142.250.180.163","10.9.14.244","TLSv1.3","85","Application Data","","0x018"
"80","2.335732","142.250.180.163","10.9.14.244","TLSv1.3","93","Application Data","","0x018"
"81","2.335803","10.9.14.244","142.250.180.163","TCP","54","62466  >  443 [ACK] Seq=2317 Ack=7283 Win=65280 Len=0","","0x010"
"82","2.336774","10.9.14.244","142.250.180.163","TLSv1.3","93","Application Data","","0x018"
"83","2.348664","10.9.14.244","142.250.180.163","TCP","54","62466  >  443 [FIN, ACK] Seq=2356 Ack=7283 Win=65280 Len=0","","0x011"
"84","2.375847","142.250.180.163","10.9.14.244","TCP","56","443  >  62466 [ACK] Seq=7283 Ack=2317 Win=267776 Len=0","","0x010"
"85","2.389707","142.250.180.163","10.9.14.244","TCP","56","443  >  62466 [ACK] Seq=7283 Ack=2356 Win=267776 Len=0","","0x010"
"86","2.402456","142.250.180.163","10.9.14.244","TCP","56","443  >  62466 [FIN, ACK] Seq=7283 Ack=2357 Win=267776 Len=0","","0x011"
"87","2.402665","10.9.14.244","142.250.180.163","TCP","54","62466  >  443 [ACK] Seq=2357 Ack=7284 Win=65280 Len=0","","0x010"
"88","2.441552","10.9.14.244","216.58.205.36","TCP","66","62467  >  443 [SYN] Seq=0 Win=65535 Len=0 MSS=1460 WS=256 SACK_PERM","","0x002"
"89","2.441899","10.9.14.244","216.58.205.36","TCP","66","62468  >  443 [SYN] Seq=0 Win=65535 Len=0 MSS=1460 WS=256 SACK_PERM","","0x002"
"90","2.467800","52.182.143.212","10.9.14.244","TCP","66","443  >  62465 [ACK] Seq=4685 Ack=5707 Win=4195584 Len=0 TSval=722119994 TSecr=145625858","","0x010"
"91","2.467860","10.9.14.244","52.182.143.212","TLSv1.2","930","Application Data","","0x018"
"92","2.469193","10.9.14.244","74.125.133.84","TCP","66","62469  >  443 [SYN] Seq=0 Win=65535 Len=0 MSS=1460 WS=256 SACK_PERM","","0x002"
"93","2.499628","216.58.205.36","10.9.14.244","TCP","66","443  >  62467 [SYN, ACK] Seq=0 Ack=1 Win=65535 Len=0 MSS=1380 SACK_PERM WS=256","","0x012"
"94","2.499628","216.58.205.36","10.9.14.244","TCP","66","443  >  62468 [SYN, ACK] Seq=0 Ack=1 Win=65535 Len=0 MSS=1380 SACK_PERM WS=256","","0x012"
"95","2.499744","10.9.14.244","216.58.205.36","TCP","54","62467  >  443 [ACK] Seq=1 Ack=1 Win=65280 Len=0","","0x010"
"96","2.499775","10.9.14.244","216.58.205.36","TCP","54","62468  >  443 [ACK] Seq=1 Ack=1 Win=65280 Len=0","","0x010"
"97","2.500256","10.9.14.244","216.58.205.36","TCP","1434","62467  >  443 [ACK] Seq=1 Ack=1 Win=65280 Len=1380 [TCP PDU reassembled in 98]","","0x010"
"98","2.500256","10.9.14.244","216.58.205.36","TLSv1.3","398","Client Hello (SNI=www.google.com)","www.google.com","0x018"
"99","2.500795","10.9.14.244","216.58.205.36","TCP","1434","62468  >  443 [ACK] Seq=1 Ack=1 Win=65280 Len=1380 [TCP PDU reassembled in 100]","","0x010"
"100","2.500795","10.9.14.244","216.58.205.36","TLSv1.3","462","Client Hello (SNI=www.google.com)","www.google.com","0x018"
"101","2.508584","52.182.143.212","10.9.14.244","TCP","66","443  >  62465 [ACK] Seq=4685 Ack=7075 Win=4195584 Len=0 TSval=722120034 TSecr=145625861","","0x010"
"102","2.539760","74.125.133.84","10.9.14.244","TCP","66","443  >  62469 [SYN, ACK] Seq=0 Ack=1 Win=65535 Len=0 MSS=1380 SACK_PERM WS=256","","0x012"
"103","2.539930","10.9.14.244","74.125.133.84","TCP","54","62469  >  443 [ACK] Seq=1 Ack=1 Win=65280 Len=0","","0x010"
"104","2.540417","10.9.14.244","74.125.133.84","TCP","1434","62469  >  443 [ACK] Seq=1 Ack=1 Win=65280 Len=1380 [TCP PDU reassembled in 105]","","0x010"
"105","2.540417","10.9.14.244","74.125.133.84","TLSv1.3","499","Client Hello (SNI=accounts.google.com)","accounts.google.com","0x018"
"106","2.554112","216.58.205.36","10.9.14.244","TCP","56","443  >  62467 [ACK] Seq=1 Ack=1381 Win=268544 Len=0","","0x010"
"107","2.554112","216.58.205.36","10.9.14.244","TCP","56","443  >  62468 [ACK] Seq=1 Ack=1381 Win=268544 Len=0","","0x010"
"108","2.554112","216.58.205.36","10.9.14.244","TCP","56","443  >  62467 [ACK] Seq=1 Ack=1725 Win=268288 Len=0","","0x010"
"109","2.554112","216.58.205.36","10.9.14.244","TCP","56","443  >  62468 [ACK] Seq=1 Ack=1789 Win=268288 Len=0","","0x010"
"110","2.570533","216.58.205.36","10.9.14.244","TLSv1.3","1434","Server Hello, Change Cipher Spec","","0x010"
"111","2.570533","216.58.205.36","10.9.14.244","TCP","1434","443  >  62467 [PSH, ACK] Seq=1381 Ack=1725 Win=268288 Len=1380 [TCP PDU reassembled in 113]","","0x018"
"112","2.570533","216.58.205.36","10.9.14.244","TCP","1434","443  >  62467 [ACK] Seq=2761 Ack=1725 Win=268288 Len=1380 [TCP PDU reassembled in 113]","","0x010"
"113","2.570533","216.58.205.36","10.9.14.244","TLSv1.3","1293","Application Data","","0x018"
"114","2.570533","216.58.205.36","10.9.14.244","TLSv1.3","1434","Server Hello, Change Cipher Spec","","0x010"
"115","2.570533","216.58.205.36","10.9.14.244","TCP","1434","443  >  62468 [PSH, ACK] Seq=1381 Ack=1789 Win=268288 Len=1380 [TCP PDU reassembled in 117]","","0x018"
"116","2.570533","216.58.205.36","10.9.14.244","TCP","1434","443  >  62468 [ACK] Seq=2761 Ack=1789 Win=268288 Len=1380 [TCP PDU reassembled in 117]","","0x010"
"117","2.570533","216.58.205.36","10.9.14.244","TLSv1.3","1293","Application Data","","0x018"
"118","2.570711","10.9.14.244","216.58.205.36","TCP","54","62467  >  443 [ACK] Seq=1725 Ack=5380 Win=65280 Len=0","","0x010"
"119","2.570740","10.9.14.244","216.58.205.36","TCP","54","62468  >  443 [ACK] Seq=1789 Ack=5380 Win=65280 Len=0","","0x010"
"120","2.573152","10.9.14.244","216.58.205.36","TLSv1.3","128","Change Cipher Spec, Application Data","","0x018"
"121","2.573889","10.9.14.244","216.58.205.36","TLSv1.3","128","Change Cipher Spec, Application Data","","0x018"
"122","2.610496","74.125.133.84","10.9.14.244","TCP","56","443  >  62469 [ACK] Seq=1 Ack=1381 Win=268544 Len=0","","0x010"
"123","2.610496","74.125.133.84","10.9.14.244","TCP","56","443  >  62469 [ACK] Seq=1 Ack=1826 Win=268288 Len=0","","0x010"
"124","2.610496","74.125.133.84","10.9.14.244","TLSv1.3","1434","Server Hello, Change Cipher Spec","","0x010"
"125","2.610496","74.125.133.84","10.9.14.244","TCP","1434","443  >  62469 [PSH, ACK] Seq=1381 Ack=1826 Win=268288 Len=1380 [TCP PDU reassembled in 128]","","0x018"
"126","2.610496","74.125.133.84","10.9.14.244","TCP","1434","443  >  62469 [ACK] Seq=2761 Ack=1826 Win=268288 Len=1380 [TCP PDU reassembled in 128]","","0x010"
"127","2.610655","10.9.14.244","74.125.133.84","TCP","54","62469  >  443 [ACK] Seq=1826 Ack=4141 Win=65280 Len=0","","0x010"
"128","2.612451","74.125.133.84","10.9.14.244","TLSv1.3","1305","Application Data","","0x018"
"129","2.612670","10.9.14.244","74.125.133.84","TCP","54","62469  >  443 [ACK] Seq=1826 Ack=5392 Win=64256 Len=0","","0x010"
"130","2.615239","10.9.14.244","74.125.133.84","TLSv1.3","128","Change Cipher Spec, Application Data","","0x018"
"131","2.632505","216.58.205.36","10.9.14.244","TCP","56","443  >  62467 [ACK] Seq=5380 Ack=1799 Win=268288 Len=0","","0x010"
"132","2.632505","216.58.205.36","10.9.14.244","TCP","56","443  >  62468 [ACK] Seq=5380 Ack=1863 Win=268288 Len=0","","0x010"
"133","2.655013","52.182.143.212","10.9.14.244","TLSv1.2","245","Application Data","","0x018"
"134","2.656333","10.9.14.244","52.182.143.212","TCP","66","62465  >  443 [FIN, ACK] Seq=7939 Ack=4864 Win=7424 Len=0 TSval=145626238 TSecr=722120180","","0x011"
"135","2.687914","74.125.133.84","10.9.14.244","TLSv1.3","1022","Application Data, Application Data","","0x018"
"136","2.741662","10.9.14.244","74.125.133.84","TCP","54","62469  >  443 [ACK] Seq=1900 Ack=6360 Win=65280 Len=0","","0x010"
"137","2.814943","10.9.14.244","216.58.205.46","TCP","66","62471  >  443 [SYN] Seq=0 Win=65535 Len=0 MSS=1460 WS=256 SACK_PERM","","0x002"
"138","2.824596","10.9.14.244","52.182.143.212","TCP","74","62472  >  443 [SYN] Seq=0 Win=65535 Len=0 MSS=1460 WS=256 SACK_PERM TSval=145626406 TSecr=0","","0x002"
"139","2.842585","52.182.143.212","10.9.14.244","TCP","66","[TCP Previous segment not captured] 443  >  62465 [FIN, ACK] Seq=4906 Ack=7940 Win=4194560 Len=0 TSval=722120368 TSecr=145626238","","0x011"
"140","2.842585","52.182.143.212","10.9.14.244","TCP","108","[TCP Out-Of-Order] 443  >  62465 [PSH, ACK] Seq=4864 Ack=7940 Win=4194560 Len=42 TSval=722120368 TSecr=145626238","","0x018"
"141","2.842647","10.9.14.244","52.182.143.212","TCP","66","[TCP Dup ACK 134#1] 62465  >  443 [ACK] Seq=7940 Ack=4864 Win=7424 Len=0 TSval=145626424 TSecr=722120180","","0x010"
"142","2.842699","10.9.14.244","52.182.143.212","TCP","54","62465  >  443 [RST, ACK] Seq=7940 Ack=4906 Win=0 Len=0","","0x014"
"143","2.852158","10.9.14.244","216.58.204.234","TCP","66","62473  >  443 [SYN] Seq=0 Win=65535 Len=0 MSS=1460 WS=256 SACK_PERM","","0x002"
"144","2.878061","216.58.205.46","10.9.14.244","TCP","66","443  >  62471 [SYN, ACK] Seq=0 Ack=1 Win=65535 Len=0 MSS=1380 SACK_PERM WS=256","","0x012"
"145","2.878160","10.9.14.244","216.58.205.46","TCP","54","62471  >  443 [ACK] Seq=1 Ack=1 Win=65280 Len=0","","0x010"
"146","2.878467","10.9.14.244","216.58.205.46","TCP","1434","62471  >  443 [ACK] Seq=1 Ack=1 Win=65280 Len=1380 [TCP PDU reassembled in 147]","","0x010"
"147","2.878467","10.9.14.244","216.58.205.46","TLSv1.3","430","Client Hello (SNI=lh3.google.com)","lh3.google.com","0x018"
"148","2.906301","216.58.204.234","10.9.14.244","TCP","66","443  >  62473 [SYN, ACK] Seq=0 Ack=1 Win=65535 Len=0 MSS=1380 SACK_PERM WS=256","","0x012"
"149","2.906356","10.9.14.244","216.58.204.234","TCP","54","62473  >  443 [ACK] Seq=1 Ack=1 Win=65280 Len=0","","0x010"
"150","2.906990","10.9.14.244","216.58.204.234","TCP","1434","62473  >  443 [ACK] Seq=1 Ack=1 Win=65280 Len=1380 [TCP PDU reassembled in 151]","","0x010"
"151","2.906990","10.9.14.244","216.58.204.234","TLSv1.3","444","Client Hello (SNI=ogads-pa.clients6.google.com)","ogads-pa.clients6.google.com","0x018"
"152","2.931758","216.58.205.46","10.9.14.244","TCP","56","443  >  62471 [ACK] Seq=1 Ack=1381 Win=268800 Len=0","","0x010"
"153","2.931758","216.58.205.46","10.9.14.244","TCP","56","443  >  62471 [ACK] Seq=1 Ack=1757 Win=268800 Len=0","","0x010"
"154","2.948041","216.58.205.46","10.9.14.244","TLSv1.3","1434","Server Hello, Change Cipher Spec","","0x010"
"155","2.948041","216.58.205.46","10.9.14.244","TCP","1434","443  >  62471 [PSH, ACK] Seq=1381 Ack=1757 Win=268800 Len=1380 [TCP PDU reassembled in 159]","","0x018"
"156","2.948041","216.58.205.46","10.9.14.244","TCP","1434","443  >  62471 [ACK] Seq=2761 Ack=1757 Win=268800 Len=1380 [TCP PDU reassembled in 159]","","0x010"
"157","2.948041","216.58.205.46","10.9.14.244","TCP","1434","443  >  62471 [PSH, ACK] Seq=4141 Ack=1757 Win=268800 Len=1380 [TCP PDU reassembled in 159]","","0x018"
"158","2.948041","216.58.205.46","10.9.14.244","TCP","1434","443  >  62471 [ACK] Seq=5521 Ack=1757 Win=268800 Len=1380 [TCP PDU reassembled in 159]","","0x010"
"159","2.948041","216.58.205.46","10.9.14.244","TLSv1.3","1010","Application Data","","0x018"
"160","2.948131","10.9.14.244","216.58.205.46","TCP","54","62471  >  443 [ACK] Seq=1757 Ack=7857 Win=65280 Len=0","","0x010"
"161","2.948714","10.9.14.244","216.58.205.46","TLSv1.3","128","Change Cipher Spec, Application Data","","0x018"
"162","2.959872","216.58.204.234","10.9.14.244","TCP","56","443  >  62473 [ACK] Seq=1 Ack=1381 Win=268544 Len=0","","0x010"
"163","2.959872","216.58.204.234","10.9.14.244","TCP","56","443  >  62473 [ACK] Seq=1 Ack=1771 Win=268288 Len=0","","0x010"
"164","2.980026","216.58.204.234","10.9.14.244","TLSv1.3","1434","Server Hello, Change Cipher Spec","","0x010"
"165","2.980026","216.58.204.234","10.9.14.244","TCP","1434","443  >  62473 [PSH, ACK] Seq=1381 Ack=1771 Win=268288 Len=1380 [TCP PDU reassembled in 171]","","0x018"
"166","2.980026","216.58.204.234","10.9.14.244","TCP","1434","443  >  62473 [ACK] Seq=2761 Ack=1771 Win=268288 Len=1380 [TCP PDU reassembled in 171]","","0x010"
"167","2.980026","216.58.204.234","10.9.14.244","TCP","1434","443  >  62473 [PSH, ACK] Seq=4141 Ack=1771 Win=268288 Len=1380 [TCP PDU reassembled in 171]","","0x018"
"168","2.980026","216.58.204.234","10.9.14.244","TCP","1434","443  >  62473 [ACK] Seq=5521 Ack=1771 Win=268288 Len=1380 [TCP PDU reassembled in 171]","","0x010"
"169","2.980026","216.58.204.234","10.9.14.244","TCP","1434","443  >  62473 [PSH, ACK] Seq=6901 Ack=1771 Win=268288 Len=1380 [TCP PDU reassembled in 171]","","0x018"
"170","2.980026","216.58.204.234","10.9.14.244","TCP","1434","443  >  62473 [ACK] Seq=8281 Ack=1771 Win=268288 Len=1380 [TCP PDU reassembled in 171]","","0x010"
"171","2.980026","216.58.204.234","10.9.14.244","TLSv1.3","1289","Application Data","","0x018"
"172","2.980140","10.9.14.244","216.58.204.234","TCP","54","62473  >  443 [ACK] Seq=1771 Ack=10896 Win=65280 Len=0","","0x010"
"173","2.980648","10.9.14.244","216.58.204.234","TLSv1.3","128","Change Cipher Spec, Application Data","","0x018"
"174","2.983903","10.9.14.244","142.250.180.161","QUIC","1292","Initial, DCID=5c3002be47ef0dbb, PKN: 1, CRYPTO, CRYPTO, CRYPTO, CRYPTO, CRYPTO, PING, PADDING, PING, CRYPTO, PADDING, CRYPTO, PING","",""
"175","2.984195","10.9.14.244","142.250.180.161","QUIC","1292","Initial, DCID=5c3002be47ef0dbb, PKN: 2, PING, CRYPTO, PADDING, CRYPTO, CRYPTO, PADDING, CRYPTO, PING, CRYPTO, PADDING, CRYPTO, PING","lh3.googleusercontent.com",""
"176","3.001002","52.182.143.212","10.9.14.244","TCP","74","443  >  62472 [SYN, ACK] Seq=0 Ack=1 Win=65535 Len=0 MSS=1380 WS=256 SACK_PERM TSval=722725911 TSecr=145626406","","0x012"
"177","3.001002","216.58.205.46","10.9.14.244","TLSv1.3","1012","Application Data, Application Data","","0x018"
"178","3.001076","10.9.14.244","52.182.143.212","TCP","66","62472  >  443 [ACK] Seq=1 Ack=1 Win=2560 Len=0 TSval=145626582 TSecr=722725911","","0x010"
"179","3.002298","10.9.14.244","52.182.143.212","TLSv1.2","281","Client Hello (SNI=watson.events.data.microsoft.com)","watson.events.data.microsoft.com","0x018"
"180","3.033988","216.58.204.234","10.9.14.244","TLSv1.3","1040","Application Data, Application Data","","0x018"
"181","3.039912","10.9.14.244","142.250.180.161","QUIC","1292","Initial, DCID=fc3002be47ef0dbb","",""
"182","3.055609","10.9.14.244","142.250.180.161","QUIC","81","Handshake, DCID=fc3002be47ef0dbb","",""
"183","3.055985","10.9.14.244","216.58.205.46","TCP","54","62471  >  443 [ACK] Seq=1831 Ack=8815 Win=64512 Len=0","","0x010"
"184","3.072009","10.9.14.244","142.250.180.161","QUIC","82","Handshake, DCID=fc3002be47ef0dbb","",""
"185","3.072680","10.9.14.244","142.250.180.161","TCP","66","62474  >  443 [SYN] Seq=0 Win=65535 Len=0 MSS=1460 WS=256 SACK_PERM","","0x002"
"186","3.086809","10.9.14.244","216.58.204.234","TCP","54","62473  >  443 [ACK] Seq=1845 Ack=11882 Win=64512 Len=0","","0x010"
"187","3.093633","10.9.14.244","142.250.180.161","QUIC","82","Handshake, DCID=fc3002be47ef0dbb","",""
"188","3.095188","10.9.14.244","142.250.180.161","QUIC","125","Handshake, DCID=fc3002be47ef0dbb","",""
"189","3.095455","10.9.14.244","142.250.180.161","QUIC","114","Protected Payload (KP0)","",""
"190","3.095752","10.9.14.244","142.250.180.161","QUIC","1288","Protected Payload (KP0)","",""
"191","3.095782","10.9.14.244","142.250.180.161","QUIC","501","Protected Payload (KP0)","",""
"192","3.126178","142.250.180.161","10.9.14.244","TCP","66","443  >  62474 [SYN, ACK] Seq=0 Ack=1 Win=65535 Len=0 MSS=1380 SACK_PERM WS=256","","0x012"
"193","3.126246","10.9.14.244","142.250.180.161","TCP","54","62474  >  443 [ACK] Seq=1 Ack=1 Win=65280 Len=0","","0x010"
"194","3.126742","10.9.14.244","142.250.180.161","TCP","1434","62474  >  443 [ACK] Seq=1 Ack=1 Win=65280 Len=1380 [TCP PDU reassembled in 195]","","0x010"
"195","3.126742","10.9.14.244","142.250.180.161","TLSv1.3","473","Client Hello (SNI=lh3.googleusercontent.com)","lh3.googleusercontent.com","0x018"
"196","3.148404","10.9.14.244","142.250.180.161","QUIC","75","Protected Payload (KP0)","",""
"197","3.148521","10.9.14.244","142.250.180.161","QUIC","75","Protected Payload (KP0)","",""
"198","3.175505","10.9.14.244","142.250.180.161","QUIC","75","Protected Payload (KP0)","",""
"199","3.179033","142.250.180.161","10.9.14.244","TCP","56","443  >  62474 [ACK] Seq=1 Ack=1381 Win=268544 Len=0","","0x010"
"200","3.180229","142.250.180.161","10.9.14.244","TCP","56","443  >  62474 [ACK] Seq=1 Ack=1800 Win=268288 Len=0","","0x010"
"201","3.180229","52.182.143.212","10.9.14.244","TCP","1434","443  >  62472 [ACK] Seq=1 Ack=216 Win=4195328 Len=1368 TSval=722726090 TSecr=145626584 [TCP PDU reassembled in 218]","","0x010"
"202","3.181705","10.9.14.244","142.250.180.161","QUIC","79","Protected Payload (KP0)","",""
"203","3.196310","142.250.180.161","10.9.14.244","TLSv1.3","1434","Server Hello, Change Cipher Spec","","0x010"
"204","3.196310","142.250.180.161","10.9.14.244","TCP","1434","443  >  62474 [PSH, ACK] Seq=1381 Ack=1800 Win=268288 Len=1380 [TCP PDU reassembled in 210]","","0x018"
"205","3.196310","142.250.180.161","10.9.14.244","TCP","1434","443  >  62474 [ACK] Seq=2761 Ack=1800 Win=268288 Len=1380 [TCP PDU reassembled in 210]","","0x010"
"206","3.196310","142.250.180.161","10.9.14.244","TCP","1434","443  >  62474 [PSH, ACK] Seq=4141 Ack=1800 Win=268288 Len=1380 [TCP PDU reassembled in 210]","","0x018"
"207","3.196310","142.250.180.161","10.9.14.244","TCP","1434","443  >  62474 [ACK] Seq=5521 Ack=1800 Win=268288 Len=1380 [TCP PDU reassembled in 210]","","0x010"
"208","3.196310","142.250.180.161","10.9.14.244","TCP","1434","443  >  62474 [PSH, ACK] Seq=6901 Ack=1800 Win=268288 Len=1380 [TCP PDU reassembled in 210]","","0x018"
"209","3.196310","142.250.180.161","10.9.14.244","TCP","1434","443  >  62474 [ACK] Seq=8281 Ack=1800 Win=268288 Len=1380 [TCP PDU reassembled in 210]","","0x010"
"210","3.196310","142.250.180.161","10.9.14.244","TLSv1.3","883","Application Data","","0x018"
"211","3.196386","10.9.14.244","142.250.180.161","TCP","54","62474  >  443 [ACK] Seq=1800 Ack=10490 Win=65280 Len=0","","0x010"
"212","3.197246","10.9.14.244","142.250.180.161","TLSv1.3","128","Change Cipher Spec, Application Data","","0x018"
"213","3.230531","10.9.14.244","52.182.143.212","TCP","66","62472  >  443 [ACK] Seq=216 Ack=1369 Win=4096 Len=0 TSval=145626812 TSecr=722726090","","0x010"
"214","3.250484","142.250.180.161","10.9.14.244","TLSv1.3","1034","Application Data, Application Data","","0x018"
"215","3.293826","10.9.14.244","142.250.180.161","TCP","54","62474  >  443 [ACK] Seq=1874 Ack=11470 Win=64512 Len=0","","0x010"
"216","3.407575","52.182.143.212","10.9.14.244","TCP","1434","443  >  62472 [ACK] Seq=1369 Ack=216 Win=4195328 Len=1368 TSval=722726317 TSecr=145626812 [TCP PDU reassembled in 218]","","0x010"
"217","3.407575","52.182.143.212","10.9.14.244","TCP","1434","443  >  62472 [ACK] Seq=2737 Ack=216 Win=4195328 Len=1368 TSval=722726317 TSecr=145626812 [TCP PDU reassembled in 218]","","0x010"
"218","3.407575","52.182.143.212","10.9.14.244","TLSv1.2","488","Server Hello, Certificate, Server Key Exchange, Server Hello Done","","0x018"
"219","3.407650","10.9.14.244","52.182.143.212","TCP","66","62472  >  443 [ACK] Seq=216 Ack=4527 Win=7168 Len=0 TSval=145626989 TSecr=722726317","","0x010"
"220","3.415149","10.9.14.244","52.182.143.212","TLSv1.2","224","Client Key Exchange, Change Cipher Spec, Encrypted Handshake Message","","0x018"
"221","3.563399","10.9.14.244","13.107.42.16","TCP","66","62475  >  443 [SYN] Seq=0 Win=65535 Len=0 MSS=1460 WS=256 SACK_PERM","","0x002"
"222","3.592727","52.182.143.212","10.9.14.244","TLSv1.2","117","Change Cipher Spec, Encrypted Handshake Message","","0x018"
"223","3.592727","52.182.143.212","10.9.14.244","TLSv1.2","135","Application Data","","0x018"
"224","3.592796","10.9.14.244","52.182.143.212","TCP","66","62472  >  443 [ACK] Seq=374 Ack=4647 Win=7168 Len=0 TSval=145627174 TSecr=722726495","","0x010"
"225","3.595891","10.9.14.244","52.182.143.212","TLSv1.2","153","Application Data","","0x018"
"226","3.596129","10.9.14.244","52.182.143.212","TLSv1.2","1170","Application Data","","0x018"
"227","3.596318","10.9.14.244","52.182.143.212","TLSv1.2","104","Application Data","","0x018"
"228","3.598043","10.9.14.244","52.182.143.212","TCP","1434","62472  >  443 [ACK] Seq=1603 Ack=4647 Win=7168 Len=1368 TSval=145627179 TSecr=722726495 [TCP PDU reassembled in 257]","","0x010"
"229","3.617107","13.107.42.16","10.9.14.244","TCP","66","443  >  62475 [SYN, ACK] Seq=0 Ack=1 Win=65535 Len=0 MSS=1380 WS=256 SACK_PERM","","0x012"
"230","3.617223","10.9.14.244","13.107.42.16","TCP","54","62475  >  443 [ACK] Seq=1 Ack=1 Win=65280 Len=0","","0x010"
"231","3.618173","10.9.14.244","13.107.42.16","TCP","1434","62475  >  443 [ACK] Seq=1 Ack=1 Win=65280 Len=1380 [TCP PDU reassembled in 232]","","0x010"
"232","3.618173","10.9.14.244","13.107.42.16","TLSv1.2","405","Client Hello (SNI=config.edge.skype.com)","config.edge.skype.com","0x018"
"233","3.674280","13.107.42.16","10.9.14.244","TCP","56","443  >  62475 [ACK] Seq=1 Ack=1381 Win=4195072 Len=0","","0x010"
"234","3.674280","13.107.42.16","10.9.14.244","TCP","56","443  >  62475 [ACK] Seq=1 Ack=1732 Win=4194816 Len=0","","0x010"
"235","3.675234","13.107.42.16","10.9.14.244","TCP","1434","443  >  62475 [ACK] Seq=1 Ack=1732 Win=4194816 Len=1380 [TCP PDU reassembled in 239]","","0x010"
"236","3.675234","13.107.42.16","10.9.14.244","TCP","1434","443  >  62475 [ACK] Seq=1381 Ack=1732 Win=4194816 Len=1380 [TCP PDU reassembled in 239]","","0x010"
"237","3.675234","13.107.42.16","10.9.14.244","TCP","1434","443  >  62475 [ACK] Seq=2761 Ack=1732 Win=4194816 Len=1380 [TCP PDU reassembled in 239]","","0x010"
"238","3.675234","13.107.42.16","10.9.14.244","TCP","1434","443  >  62475 [ACK] Seq=4141 Ack=1732 Win=4194816 Len=1380 [TCP PDU reassembled in 239]","","0x010"
"239","3.675234","13.107.42.16","10.9.14.244","TLSv1.2","529","Server Hello, Certificate, Certificate Status, Server Key Exchange, Server Hello Done","","0x018"
"240","3.675420","10.9.14.244","13.107.42.16","TCP","54","62475  >  443 [ACK] Seq=1732 Ack=5996 Win=65280 Len=0","","0x010"
"241","3.681161","10.9.14.244","13.107.42.16","TLSv1.2","212","Client Key Exchange, Change Cipher Spec, Encrypted Handshake Message","","0x018"
"242","3.681703","10.9.14.244","13.107.42.16","TLSv1.2","153","Application Data","","0x018"
"243","3.681969","10.9.14.244","13.107.42.16","TLSv1.2","493","Application Data","","0x018"
"244","3.735214","13.107.42.16","10.9.14.244","TCP","56","443  >  62475 [ACK] Seq=5996 Ack=1890 Win=4194560 Len=0","","0x010"
"245","3.735214","13.107.42.16","10.9.14.244","TCP","56","443  >  62475 [ACK] Seq=5996 Ack=1989 Win=4194560 Len=0","","0x010"
"246","3.735214","13.107.42.16","10.9.14.244","TCP","56","443  >  62475 [ACK] Seq=5996 Ack=2428 Win=4194048 Len=0","","0x010"
"247","3.735214","13.107.42.16","10.9.14.244","TLSv1.2","396","New Session Ticket, Change Cipher Spec, Encrypted Handshake Message","","0x018"
"248","3.737199","13.107.42.16","10.9.14.244","TLSv1.2","123","Application Data","","0x018"
"249","3.737199","13.107.42.16","10.9.14.244","TCP","56","[TCP Dup ACK 246#1] 443  >  62475 [ACK] Seq=6407 Ack=2428 Win=4194048 Len=0","","0x010"
"250","3.737309","10.9.14.244","13.107.42.16","TCP","54","62475  >  443 [ACK] Seq=2428 Ack=6407 Win=65024 Len=0","","0x010"
"251","3.737837","10.9.14.244","13.107.42.16","TLSv1.2","92","Application Data","","0x018"
"252","3.772888","52.182.143.212","10.9.14.244","TCP","66","443  >  62472 [ACK] Seq=4647 Ack=1603 Win=4195584 Len=0 TSval=722726683 TSecr=145627177","","0x010"
"253","3.772888","52.182.143.212","10.9.14.244","TLSv1.2","104","Application Data","","0x018"
"254","3.772888","52.182.143.212","10.9.14.244","TCP","66","443  >  62472 [ACK] Seq=4685 Ack=2971 Win=4195584 Len=0 TSval=722726684 TSecr=145627179","","0x010"
"255","3.772995","10.9.14.244","52.182.143.212","TCP","1434","62472  >  443 [ACK] Seq=2971 Ack=4685 Win=7424 Len=1368 TSval=145627354 TSecr=722726683 [TCP PDU reassembled in 257]","","0x010"
"256","3.772995","10.9.14.244","52.182.143.212","TCP","1434","62472  >  443 [ACK] Seq=4339 Ack=4685 Win=7424 Len=1368 TSval=145627354 TSecr=722726683 [TCP PDU reassembled in 257]","","0x010"
"257","3.772995","10.9.14.244","52.182.143.212","TLSv1.2","1434","Application Data","","0x018"
"258","3.790528","13.107.42.16","10.9.14.244","TLSv1.2","92","Application Data","","0x018"
"259","3.790528","13.107.42.16","10.9.14.244","TCP","56","443  >  62475 [ACK] Seq=6445 Ack=2466 Win=4194048 Len=0","","0x010"
"260","3.837474","10.9.14.244","13.107.42.16","TCP","54","62475  >  443 [ACK] Seq=2466 Ack=6445 Win=65024 Len=0","","0x010"
"261","3.850604","13.107.42.16","10.9.14.244","TCP","1434","443  >  62475 [ACK] Seq=6445 Ack=2466 Win=4194048 Len=1380 [TCP PDU reassembled in 262]","","0x010"
"262","3.850604","13.107.42.16","10.9.14.244","TLSv1.2","1281","Application Data","","0x018"
"263","3.850604","13.107.42.16","10.9.14.244","TLSv1.2","92","Application Data","","0x018"
"264","3.850637","10.9.14.244","13.107.42.16","TCP","54","62475  >  443 [ACK] Seq=2466 Ack=9090 Win=65280 Len=0","","0x010"
"265","3.851325","10.9.14.244","142.251.209.14","TCP","66","62476  >  443 [SYN] Seq=0 Win=65535 Len=0 MSS=1460 WS=256 SACK_PERM","","0x002"
"266","3.854798","10.9.14.244","13.107.42.16","TCP","54","62475  >  443 [FIN, ACK] Seq=2466 Ack=9090 Win=65280 Len=0","","0x011"
"267","3.904556","142.251.209.14","10.9.14.244","TCP","66","443  >  62476 [SYN, ACK] Seq=0 Ack=1 Win=65535 Len=0 MSS=1380 SACK_PERM WS=256","","0x012"
"268","3.904675","10.9.14.244","142.251.209.14","TCP","54","62476  >  443 [ACK] Seq=1 Ack=1 Win=65280 Len=0","","0x010"
"269","3.905437","10.9.14.244","142.251.209.14","TCP","1434","62476  >  443 [ACK] Seq=1 Ack=1 Win=65280 Len=1380 [TCP PDU reassembled in 270]","","0x010"
"270","3.905437","10.9.14.244","142.251.209.14","TLSv1.3","399","Client Hello (SNI=play.google.com)","play.google.com","0x018"
"271","3.907755","13.107.42.16","10.9.14.244","TCP","56","443  >  62475 [ACK] Seq=9090 Ack=2467 Win=4194048 Len=0","","0x010"
"272","3.907755","13.107.42.16","10.9.14.244","TCP","56","443  >  62475 [FIN, ACK] Seq=9090 Ack=2467 Win=4194048 Len=0","","0x011"
"273","3.907814","10.9.14.244","13.107.42.16","TCP","54","62475  >  443 [ACK] Seq=2467 Ack=9091 Win=65280 Len=0","","0x010"
"274","3.948876","52.182.143.212","10.9.14.244","TCP","66","443  >  62472 [ACK] Seq=4685 Ack=5707 Win=4195584 Len=0 TSval=722726859 TSecr=145627354","","0x010"
"275","3.948903","10.9.14.244","52.182.143.212","TLSv1.2","930","Application Data","","0x018"
"276","3.958261","142.251.209.14","10.9.14.244","TCP","56","443  >  62476 [ACK] Seq=1 Ack=1381 Win=268544 Len=0","","0x010"
"277","3.958261","142.251.209.14","10.9.14.244","TCP","56","443  >  62476 [ACK] Seq=1 Ack=1726 Win=268288 Len=0","","0x010"
"278","3.974655","142.251.209.14","10.9.14.244","TLSv1.3","1434","Server Hello, Change Cipher Spec","","0x010"
"279","3.974655","142.251.209.14","10.9.14.244","TCP","1434","443  >  62476 [PSH, ACK] Seq=1381 Ack=1726 Win=268288 Len=1380 [TCP PDU reassembled in 283]","","0x018"
"280","3.974655","142.251.209.14","10.9.14.244","TCP","1434","443  >  62476 [ACK] Seq=2761 Ack=1726 Win=268288 Len=1380 [TCP PDU reassembled in 283]","","0x010"
"281","3.974655","142.251.209.14","10.9.14.244","TCP","1434","443  >  62476 [PSH, ACK] Seq=4141 Ack=1726 Win=268288 Len=1380 [TCP PDU reassembled in 283]","","0x018"
"282","3.974655","142.251.209.14","10.9.14.244","TCP","1434","443  >  62476 [ACK] Seq=5521 Ack=1726 Win=268288 Len=1380 [TCP PDU reassembled in 283]","","0x010"
"283","3.974655","142.251.209.14","10.9.14.244","TLSv1.3","847","Application Data","","0x018"
"284","3.974712","10.9.14.244","142.251.209.14","TCP","54","62476  >  443 [ACK] Seq=1726 Ack=7694 Win=65280 Len=0","","0x010"
"285","3.975360","10.9.14.244","142.251.209.14","TLSv1.3","118","Change Cipher Spec, Application Data","","0x018"
"286","4.000733","52.182.143.212","10.9.14.244","TCP","66","443  >  62472 [ACK] Seq=4685 Ack=7075 Win=4195584 Len=0 TSval=722726911 TSecr=145627354","","0x010"
"287","4.028375","142.251.209.14","10.9.14.244","TLSv1.3","670","Application Data, Application Data","","0x018"
"288","4.083197","10.9.14.244","142.251.209.14","TCP","54","62476  >  443 [ACK] Seq=1790 Ack=8310 Win=64768 Len=0","","0x010"
"289","4.127186","52.182.143.212","10.9.14.244","TLSv1.2","245","Application Data","","0x018"
"290","4.130260","10.9.14.244","52.182.143.212","TCP","66","62472  >  443 [FIN, ACK] Seq=7939 Ack=4864 Win=7424 Len=0 TSval=145627712 TSecr=722727036","","0x011"
"291","4.307009","52.182.143.212","10.9.14.244","TCP","66","[TCP Previous segment not captured] 443  >  62472 [FIN, ACK] Seq=4906 Ack=7940 Win=4194560 Len=0 TSval=722727217 TSecr=145627712","","0x011"
"292","4.307009","52.182.143.212","10.9.14.244","TCP","108","[TCP Out-Of-Order] 443  >  62472 [PSH, ACK] Seq=4864 Ack=7940 Win=4194560 Len=42 TSval=722727217 TSecr=145627712","","0x018"
