"No.","Time","Source","Destination","Protocol","Length","Info","TLS server name","Flags"
"1","0.000000","10.100.102.162","142.250.75.35","TCP","66","58343  >  443 [SYN] Seq=0 Win=65535 Len=0 MSS=1460 WS=256 SACK_PERM","","0x002"
"2","0.050060","142.250.75.35","10.100.102.162","TCP","66","443  >  58343 [SYN, ACK] Seq=0 Ack=1 Win=65535 Len=0 MSS=1412 SACK_PERM WS=256","","0x012"
"3","0.050591","10.100.102.162","142.250.75.35","TCP","54","58343  >  443 [ACK] Seq=1 Ack=1 Win=65280 Len=0","","0x010"
"4","0.051462","10.100.102.162","142.250.75.35","TCP","1466","58343  >  443 [ACK] Seq=1 Ack=1 Win=65280 Len=1412 [TCP PDU reassembled in 5]","","0x010"
"5","0.051462","10.100.102.162","142.250.75.35","TLSv1.3","477","Client Hello (SNI=clientservices.googleapis.com)","clientservices.googleapis.com","0x018"
"6","0.100641","142.250.75.35","10.100.102.162","TCP","66","[TCP Dup ACK 2#1] 443  >  58343 [ACK] Seq=1 Ack=1 Win=269824 Len=0 SLE=1413 SRE=1836","","0x010"
"7","0.100641","142.250.75.35","10.100.102.162","TCP","60","443  >  58343 [ACK] Seq=1 Ack=1836 Win=268032 Len=0","","0x010"
"8","0.153617","142.250.75.35","10.100.102.162","TLSv1.3","1466","Server Hello, Change Cipher Spec","","0x010"
"9","0.153617","142.250.75.35","10.100.102.162","TCP","1466","443  >  58343 [PSH, ACK] Seq=1413 Ack=1836 Win=268032 Len=1412 [TCP PDU reassembled in 13]","","0x018"
"10","0.153617","142.250.75.35","10.100.102.162","TCP","1466","443  >  58343 [ACK] Seq=2825 Ack=1836 Win=268032 Len=1412 [TCP PDU reassembled in 13]","","0x010"
"11","0.153691","10.100.102.162","142.250.75.35","TCP","54","58343  >  443 [ACK] Seq=1836 Ack=4237 Win=65280 Len=0","","0x010"
"12","0.154076","142.250.75.35","10.100.102.162","TCP","1466","443  >  58343 [PSH, ACK] Seq=4237 Ack=1836 Win=268032 Len=1412 [TCP PDU reassembled in 13]","","0x018"
"13","0.154076","142.250.75.35","10.100.102.162","TLSv1.3","165","Application Data","","0x018"
"14","0.154129","10.100.102.162","142.250.75.35","TCP","54","58343  >  443 [ACK] Seq=1836 Ack=5760 Win=65280 Len=0","","0x010"
"15","0.158236","10.100.102.162","142.250.75.35","TLSv1.3","128","Change Cipher Spec, Application Data","","0x018"
"16","0.158661","10.100.102.162","142.250.75.35","TLSv1.3","146","Application Data","","0x018"
"17","0.158969","10.100.102.162","142.250.75.35","TLSv1.3","402","Application Data","","0x018"
"18","0.185464","10.100.102.162","142.250.75.100","QUIC","1292","Initial, DCID=6d57aebe8bd4c3f4, PKN: 1, PING, CRYPTO, PADDING, CRYPTO, CRYPTO, PING, CRYPTO, PADDING, PING, PADDING, CRYPTO, CRYPTO, CRYPTO, CRYPTO, CRYPTO, PADDING, CRYPTO, CRYPTO, PING","",""
"19","0.185521","10.100.102.162","142.250.75.100","QUIC","1292","Initial, DCID=6d57aebe8bd4c3f4, PKN: 2, CRYPTO, CRYPTO, PING, CRYPTO, PING, PING, CRYPTO, PING, CRYPTO, PADDING, PING, PING, CRYPTO, CRYPTO, PING, PADDING, PING, PING, CRYPTO, CRYPTO, PADDING","www.google.com",""
"20","0.207238","142.250.75.35","10.100.102.162","TCP","56","443  >  58343 [ACK] Seq=5760 Ack=1910 Win=268032 Len=0","","0x010"
"21","0.207238","142.250.75.35","10.100.102.162","TCP","56","443  >  58343 [ACK] Seq=5760 Ack=2002 Win=268032 Len=0","","0x010"
"22","0.207238","142.250.75.35","10.100.102.162","TCP","56","443  >  58343 [ACK] Seq=5760 Ack=2350 Win=267776 Len=0","","0x010"
"23","0.207601","142.250.75.35","10.100.102.162","TLSv1.3","1042","Application Data, Application Data","","0x018"
"24","0.207601","142.250.75.35","10.100.102.162","TLSv1.3","85","Application Data","","0x018"
"25","0.207659","10.100.102.162","142.250.75.35","TCP","54","58343  >  443 [ACK] Seq=2350 Ack=6779 Win=64512 Len=0","","0x010"
"26","0.207885","10.100.102.162","142.250.75.35","TLSv1.3","85","Application Data","","0x018"
"27","0.239552","10.100.102.162","142.250.75.100","QUIC","1292","Initial, DCID=ed57aebe8bd4c3f4","",""
"28","0.262351","142.250.75.35","10.100.102.162","TCP","56","443  >  58343 [ACK] Seq=6779 Ack=2381 Win=267776 Len=0","","0x010"
"29","0.265640","10.100.102.162","142.250.75.100","TCP","66","58344  >  443 [SYN] Seq=0 Win=65535 Len=0 MSS=1460 WS=256 SACK_PERM","","0x002"
"30","0.265766","10.100.102.162","142.250.75.100","TCP","66","58345  >  443 [SYN] Seq=0 Win=65535 Len=0 MSS=1460 WS=256 SACK_PERM","","0x002"
"31","0.265854","10.100.102.162","142.250.75.100","TCP","66","58346  >  443 [SYN] Seq=0 Win=65535 Len=0 MSS=1460 WS=256 SACK_PERM","","0x002"
"32","0.265928","10.100.102.162","142.250.75.100","TCP","66","58347  >  443 [SYN] Seq=0 Win=65535 Len=0 MSS=1460 WS=256 SACK_PERM","","0x002"
"33","0.270653","142.250.75.35","10.100.102.162","TLSv1.3","487","Application Data","","0x018"
"34","0.271515","142.250.75.35","10.100.102.162","TLSv1.3","85","Application Data","","0x018"
"35","0.271515","142.250.75.35","10.100.102.162","TLSv1.3","93","Application Data","","0x018"
"36","0.271561","10.100.102.162","142.250.75.35","TCP","54","58343  >  443 [ACK] Seq=2381 Ack=7282 Win=65280 Len=0","","0x010"
"37","0.272002","10.100.102.162","142.250.75.35","TLSv1.3","93","Application Data","","0x018"
"38","0.278259","10.100.102.162","142.250.75.35","TCP","54","58343  >  443 [FIN, ACK] Seq=2420 Ack=7282 Win=65280 Len=0","","0x011"
"39","0.279872","10.100.102.162","142.250.75.100","TCP","66","58348  >  443 [SYN] Seq=0 Win=65535 Len=0 MSS=1460 WS=256 SACK_PERM","","0x002"
"40","0.280072","10.100.102.162","142.250.75.100","TCP","66","58349  >  443 [SYN] Seq=0 Win=65535 Len=0 MSS=1460 WS=256 SACK_PERM","","0x002"
"41","0.280248","10.100.102.162","142.250.75.100","TCP","66","58350  >  443 [SYN] Seq=0 Win=65535 Len=0 MSS=1460 WS=256 SACK_PERM","","0x002"
"42","0.280483","10.100.102.162","142.250.75.100","TCP","66","58351  >  443 [SYN] Seq=0 Win=65535 Len=0 MSS=1460 WS=256 SACK_PERM","","0x002"
"43","0.288551","10.100.102.162","142.251.173.84","TCP","66","58352  >  443 [SYN] Seq=0 Win=65535 Len=0 MSS=1460 WS=256 SACK_PERM","","0x002"
"44","0.288960","10.100.102.162","142.250.75.100","QUIC","79","Handshake, DCID=ed57aebe8bd4c3f4","",""
"45","0.290917","10.100.102.162","142.250.75.100","QUIC","81","Handshake, DCID=ed57aebe8bd4c3f4","",""
"46","0.291386","10.100.102.162","142.250.75.100","QUIC","81","Handshake, DCID=ed57aebe8bd4c3f4","",""
"47","0.293568","10.100.102.162","142.250.75.100","QUIC","125","Handshake, DCID=ed57aebe8bd4c3f4","",""
"48","0.293920","10.100.102.162","142.250.75.100","QUIC","115","Protected Payload (KP0)","",""
"49","0.294377","10.100.102.162","142.250.75.100","QUIC","1288","Protected Payload (KP0)","",""
"50","0.294405","10.100.102.162","142.250.75.100","QUIC","482","Protected Payload (KP0)","",""
"51","0.294483","10.100.102.162","142.250.75.100","QUIC","300","Protected Payload (KP0)","",""
"52","0.294559","10.100.102.162","142.250.75.100","QUIC","154","Protected Payload (KP0)","",""
"53","0.294605","10.100.102.162","142.250.75.100","QUIC","152","Protected Payload (KP0)","",""
"54","0.315815","142.250.75.100","10.100.102.162","TCP","66","443  >  58347 [SYN, ACK] Seq=0 Ack=1 Win=65535 Len=0 MSS=1412 SACK_PERM WS=256","","0x012"
"55","0.317195","142.250.75.100","10.100.102.162","TCP","66","443  >  58344 [SYN, ACK] Seq=0 Ack=1 Win=65535 Len=0 MSS=1412 SACK_PERM WS=256","","0x012"
"56","0.317195","142.250.75.100","10.100.102.162","TCP","66","443  >  58345 [SYN, ACK] Seq=0 Ack=1 Win=65535 Len=0 MSS=1412 SACK_PERM WS=256","","0x012"
"57","0.317195","142.250.75.100","10.100.102.162","TCP","66","443  >  58346 [SYN, ACK] Seq=0 Ack=1 Win=65535 Len=0 MSS=1412 SACK_PERM WS=256","","0x012"
"58","0.326062","142.250.75.35","10.100.102.162","TCP","56","443  >  58343 [ACK] Seq=7282 Ack=2420 Win=267776 Len=0","","0x010"
"59","0.328094","142.250.75.35","10.100.102.162","TCP","60","443  >  58343 [FIN, ACK] Seq=7282 Ack=2421 Win=267776 Len=0","","0x011"
"60","0.328134","10.100.102.162","142.250.75.35","TCP","54","58343  >  443 [ACK] Seq=2421 Ack=7283 Win=65280 Len=0","","0x010"
"61","0.329705","142.250.75.100","10.100.102.162","TCP","66","443  >  58348 [SYN, ACK] Seq=0 Ack=1 Win=65535 Len=0 MSS=1412 SACK_PERM WS=256","","0x012"
"62","0.329705","142.250.75.100","10.100.102.162","TCP","66","443  >  58351 [SYN, ACK] Seq=0 Ack=1 Win=65535 Len=0 MSS=1412 SACK_PERM WS=256","","0x012"
"63","0.329705","142.250.75.100","10.100.102.162","TCP","66","443  >  58349 [SYN, ACK] Seq=0 Ack=1 Win=65535 Len=0 MSS=1412 SACK_PERM WS=256","","0x012"
"64","0.329894","10.100.102.162","142.250.75.100","TCP","54","58348  >  443 [ACK] Seq=1 Ack=1 Win=65280 Len=0","","0x010"
"65","0.329937","10.100.102.162","142.250.75.100","TCP","54","58351  >  443 [ACK] Seq=1 Ack=1 Win=65280 Len=0","","0x010"
"66","0.329960","10.100.102.162","142.250.75.100","TCP","54","58349  >  443 [ACK] Seq=1 Ack=1 Win=65280 Len=0","","0x010"
"67","0.330115","142.250.75.100","10.100.102.162","TCP","66","443  >  58350 [SYN, ACK] Seq=0 Ack=1 Win=65535 Len=0 MSS=1412 SACK_PERM WS=256","","0x012"
"68","0.330203","10.100.102.162","142.250.75.100","TCP","54","58350  >  443 [ACK] Seq=1 Ack=1 Win=65280 Len=0","","0x010"
"69","0.330455","10.100.102.162","142.250.75.100","TCP","1466","58351  >  443 [ACK] Seq=1 Ack=1 Win=65280 Len=1412 [TCP PDU reassembled in 70]","","0x010"
"70","0.330455","10.100.102.162","142.250.75.100","TLSv1.3","462","Client Hello (SNI=www.google.com)","www.google.com","0x018"
"71","0.331093","10.100.102.162","142.250.75.100","TCP","1466","58348  >  443 [ACK] Seq=1 Ack=1 Win=65280 Len=1412 [TCP PDU reassembled in 72]","","0x010"
"72","0.331093","10.100.102.162","142.250.75.100","TLSv1.3","366","Client Hello (SNI=www.google.com)","www.google.com","0x018"
"73","0.331665","10.100.102.162","142.250.75.100","TCP","1466","58349  >  443 [ACK] Seq=1 Ack=1 Win=65280 Len=1412 [TCP PDU reassembled in 74]","","0x010"
"74","0.331665","10.100.102.162","142.250.75.100","TLSv1.3","462","Client Hello (SNI=www.google.com)","www.google.com","0x018"
"75","0.331913","10.100.102.162","142.250.75.100","TCP","1466","58350  >  443 [ACK] Seq=1 Ack=1 Win=65280 Len=1412 [TCP PDU reassembled in 76]","","0x010"
"76","0.331913","10.100.102.162","142.250.75.100","TLSv1.3","462","Client Hello (SNI=www.google.com)","www.google.com","0x018"
"77","0.340012","10.100.102.162","142.250.75.100","QUIC","205","Protected Payload (KP0)","",""
"78","0.340098","10.100.102.162","142.250.75.100","QUIC","1292","Protected Payload (KP0)","",""
"79","0.342999","10.100.102.162","142.250.75.100","QUIC","75","Protected Payload (KP0)","",""
"80","0.343137","10.100.102.162","142.250.75.100","QUIC","75","Protected Payload (KP0)","",""
"81","0.346495","10.100.102.162","142.250.75.100","QUIC","75","Protected Payload (KP0)","",""
"82","0.350772","142.251.173.84","10.100.102.162","TCP","66","443  >  58352 [SYN, ACK] Seq=0 Ack=1 Win=65535 Len=0 MSS=1412 SACK_PERM WS=256","","0x012"
"83","0.350882","10.100.102.162","142.251.173.84","TCP","54","58352  >  443 [ACK] Seq=1 Ack=1 Win=65280 Len=0","","0x010"
"84","0.351290","10.100.102.162","142.251.173.84","TCP","1466","58352  >  443 [ACK] Seq=1 Ack=1 Win=65280 Len=1412 [TCP PDU reassembled in 85]","","0x010"
"85","0.351290","10.100.102.162","142.251.173.84","TLSv1.3","435","Client Hello (SNI=accounts.google.com)","accounts.google.com","0x018"
"86","0.409482","142.250.75.100","10.100.102.162","TCP","60","443  >  58348 [ACK] Seq=1 Ack=1413 Win=268288 Len=0","","0x010"
"87","0.409482","142.250.75.100","10.100.102.162","TCP","60","443  >  58348 [ACK] Seq=1 Ack=1725 Win=268032 Len=0","","0x010"
"88","0.409482","142.250.75.100","10.100.102.162","TCP","60","443  >  58351 [ACK] Seq=1 Ack=1413 Win=268288 Len=0","","0x010"
"89","0.409482","142.250.75.100","10.100.102.162","TCP","60","443  >  58351 [ACK] Seq=1 Ack=1821 Win=268032 Len=0","","0x010"
"90","0.409482","142.250.75.100","10.100.102.162","TCP","66","[TCP Dup ACK 63#1] 443  >  58349 [ACK] Seq=1 Ack=1 Win=269824 Len=0 SLE=1413 SRE=1821","","0x010"
"91","0.409482","142.250.75.100","10.100.102.162","TCP","60","443  >  58349 [ACK] Seq=1 Ack=1821 Win=268032 Len=0","","0x010"
"92","0.409482","142.250.75.100","10.100.102.162","TCP","60","443  >  58350 [ACK] Seq=1 Ack=1413 Win=268288 Len=0","","0x010"
"93","0.409482","142.250.75.100","10.100.102.162","TCP","60","443  >  58350 [ACK] Seq=1 Ack=1821 Win=268032 Len=0","","0x010"
"94","0.412899","142.251.173.84","10.100.102.162","TCP","60","443  >  58352 [ACK] Seq=1 Ack=1413 Win=268288 Len=0","","0x010"
"95","0.412899","142.251.173.84","10.100.102.162","TCP","60","443  >  58352 [ACK] Seq=1 Ack=1794 Win=268032 Len=0","","0x010"
"96","0.413222","10.100.102.162","142.250.75.100","QUIC","82","Protected Payload (KP0)","",""
"97","0.413551","142.251.173.84","10.100.102.162","TLSv1.3","1466","Server Hello, Change Cipher Spec","","0x010"
"98","0.413551","142.251.173.84","10.100.102.162","TCP","1466","443  >  58352 [PSH, ACK] Seq=1413 Ack=1794 Win=268032 Len=1412 [TCP PDU reassembled in 101]","","0x018"
"99","0.413611","10.100.102.162","142.251.173.84","TCP","54","58352  >  443 [ACK] Seq=1794 Ack=2825 Win=65280 Len=0","","0x010"
"100","0.414378","142.251.173.84","10.100.102.162","TCP","1466","443  >  58352 [ACK] Seq=2825 Ack=1794 Win=268032 Len=1412 [TCP PDU reassembled in 101]","","0x010"
"101","0.414378","142.251.173.84","10.100.102.162","TLSv1.3","1206","Application Data","","0x018"
"102","0.414448","10.100.102.162","142.251.173.84","TCP","54","58352  >  443 [ACK] Seq=1794 Ack=5389 Win=65280 Len=0","","0x010"
"103","0.416441","10.100.102.162","142.251.173.84","TLSv1.3","128","Change Cipher Spec, Application Data","","0x018"
"104","0.431410","142.250.75.100","10.100.102.162","TLSv1.3","1466","Server Hello, Change Cipher Spec","","0x010"
"105","0.431410","142.250.75.100","10.100.102.162","TCP","1466","443  >  58348 [PSH, ACK] Seq=1413 Ack=1725 Win=268032 Len=1412 [TCP PDU reassembled in 108]","","0x018"
"106","0.431485","10.100.102.162","142.250.75.100","TCP","54","58348  >  443 [ACK] Seq=1725 Ack=2825 Win=65280 Len=0","","0x010"
"107","0.431728","142.250.75.100","10.100.102.162","TCP","1466","443  >  58348 [ACK] Seq=2825 Ack=1725 Win=268032 Len=1412 [TCP PDU reassembled in 108]","","0x010"
"108","0.431968","142.250.75.100","10.100.102.162","TLSv1.3","1198","Application Data","","0x018"
"109","0.432003","10.100.102.162","142.250.75.100","TCP","54","58348  >  443 [ACK] Seq=1725 Ack=5381 Win=65280 Len=0","","0x010"
"110","0.433068","142.250.75.100","10.100.102.162","TLSv1.3","1466","Server Hello, Change Cipher Spec","","0x010"
"111","0.433731","142.250.75.100","10.100.102.162","TCP","1466","443  >  58351 [PSH, ACK] Seq=1413 Ack=1821 Win=268032 Len=1412 [TCP PDU reassembled in 113]","","0x018"
"112","0.433731","142.250.75.100","10.100.102.162","TCP","1466","443  >  58351 [ACK] Seq=2825 Ack=1821 Win=268032 Len=1412 [TCP PDU reassembled in 113]","","0x010"
"113","0.433731","142.250.75.100","10.100.102.162","TLSv1.3","1197","Application Data","","0x018"
"114","0.433843","10.100.102.162","142.250.75.100","TCP","54","58351  >  443 [ACK] Seq=1821 Ack=5380 Win=65280 Len=0","","0x010"
"115","0.433851","10.100.102.162","142.250.75.100","TLSv1.3","128","Change Cipher Spec, Application Data","","0x018"
"116","0.434150","10.100.102.162","142.250.75.100","TLSv1.3","128","Change Cipher Spec, Application Data","","0x018"
"117","0.434438","142.250.75.100","10.100.102.162","TLSv1.3","1466","Server Hello, Change Cipher Spec","","0x010"
"118","0.436058","142.250.75.100","10.100.102.162","TCP","1466","443  >  58349 [PSH, ACK] Seq=1413 Ack=1821 Win=268032 Len=1412 [TCP PDU reassembled in 120]","","0x018"
"119","0.436058","142.250.75.100","10.100.102.162","TCP","1466","443  >  58349 [ACK] Seq=2825 Ack=1821 Win=268032 Len=1412 [TCP PDU reassembled in 120]","","0x010"
"120","0.436058","142.250.75.100","10.100.102.162","TLSv1.3","1197","Application Data","","0x018"
"121","0.436058","142.250.75.100","10.100.102.162","TLSv1.3","1466","Server Hello, Change Cipher Spec","","0x010"
"122","0.436110","10.100.102.162","142.250.75.100","TCP","54","58349  >  443 [ACK] Seq=1821 Ack=5380 Win=65280 Len=0","","0x010"
"123","0.436457","142.250.75.100","10.100.102.162","TCP","1466","443  >  58350 [PSH, ACK] Seq=1413 Ack=1821 Win=268032 Len=1412 [TCP PDU reassembled in 125]","","0x018"
"124","0.436457","142.250.75.100","10.100.102.162","TCP","1466","443  >  58350 [ACK] Seq=2825 Ack=1821 Win=268032 Len=1412 [TCP PDU reassembled in 125]","","0x010"
"125","0.436457","142.250.75.100","10.100.102.162","TLSv1.3","1197","Application Data","","0x018"
"126","0.436507","10.100.102.162","142.250.75.100","TCP","54","58350  >  443 [ACK] Seq=1821 Ack=5380 Win=65280 Len=0","","0x010"
"127","0.437391","10.100.102.162","142.250.75.100","TLSv1.3","128","Change Cipher Spec, Application Data","","0x018"
"128","0.437778","10.100.102.162","142.250.75.100","TLSv1.3","128","Change Cipher Spec, Application Data","","0x018"
"129","0.453553","10.100.102.162","142.250.75.100","QUIC","73","Protected Payload (KP0)","",""
"130","0.453645","10.100.102.162","142.250.75.100","QUIC","77","Protected Payload (KP0)","",""
"131","0.469750","10.100.102.162","142.250.75.100","QUIC","77","Protected Payload (KP0)","",""
"132","0.469846","10.100.102.162","142.250.75.100","QUIC","77","Protected Payload (KP0)","",""
"133","0.470241","10.100.102.162","142.250.75.100","QUIC","73","Protected Payload (KP0)","",""
"134","0.470291","10.100.102.162","142.250.75.100","QUIC","73","Protected Payload (KP0)","",""
"135","0.472503","10.100.102.162","142.250.75.100","QUIC","73","Protected Payload (KP0)","",""
"136","0.479162","142.251.173.84","10.100.102.162","TLSv1.3","1022","Application Data, Application Data","","0x018"
"137","0.482809","142.250.75.100","10.100.102.162","TCP","56","443  >  58348 [ACK] Seq=5381 Ack=1799 Win=268032 Len=0","","0x010"
"138","0.482809","142.250.75.100","10.100.102.162","TCP","56","443  >  58351 [ACK] Seq=5380 Ack=1895 Win=268032 Len=0","","0x010"
"139","0.485526","142.250.75.100","10.100.102.162","TCP","56","443  >  58349 [ACK] Seq=5380 Ack=1895 Win=268032 Len=0","","0x010"
"140","0.485526","142.250.75.100","10.100.102.162","TCP","56","443  >  58350 [ACK] Seq=5380 Ack=1895 Win=268032 Len=0","","0x010"
"141","0.491374","10.100.102.162","142.250.75.100","QUIC","73","Protected Payload (KP0)","",""
"142","0.493543","10.100.102.162","142.250.75.100","QUIC","73","Protected Payload (KP0)","",""
"143","0.497389","10.100.102.162","142.250.75.100","QUIC","73","Protected Payload (KP0)","",""
"144","0.499507","10.100.102.162","142.250.75.100","QUIC","73","Protected Payload (KP0)","",""
"145","0.501787","10.100.102.162","142.250.75.100","QUIC","73","Protected Payload (KP0)","",""
"146","0.513649","10.100.102.162","142.250.75.100","QUIC","73","Protected Payload (KP0)","",""
"147","0.513799","10.100.102.162","142.250.75.100","QUIC","73","Protected Payload (KP0)","",""
"148","0.513890","10.100.102.162","142.250.75.100","QUIC","73","Protected Payload (KP0)","",""
"149","0.514014","10.100.102.162","142.250.75.100","QUIC","73","Protected Payload (KP0)","",""
"150","0.514951","10.100.102.162","142.250.75.100","QUIC","73","Protected Payload (KP0)","",""
"151","0.517574","10.100.102.162","142.250.75.100","QUIC","73","Protected Payload (KP0)","",""
"152","0.519770","10.100.102.162","142.251.173.84","TCP","54","58352  >  443 [ACK] Seq=1868 Ack=6357 Win=64512 Len=0","","0x010"
"153","0.520327","10.100.102.162","142.250.75.100","QUIC","73","Protected Payload (KP0)","",""
"154","0.523280","10.100.102.162","142.250.75.100","QUIC","73","Protected Payload (KP0)","",""
"155","0.526787","10.100.102.162","142.250.75.100","QUIC","73","Protected Payload (KP0)","",""
"156","0.561323","10.100.102.162","142.250.75.100","QUIC","74","Protected Payload (KP0)","",""
"157","0.607249","10.100.102.162","142.250.75.100","QUIC","76","Protected Payload (KP0)","",""
"158","0.623134","142.250.75.100","10.100.102.162","TCP","66","[TCP Retransmission] 443  >  58347 [SYN, ACK] Seq=0 Ack=1 Win=65535 Len=0 MSS=1412 SACK_PERM WS=256","","0x012"
"159","0.623134","142.250.75.100","10.100.102.162","TCP","66","[TCP Retransmission] 443  >  58344 [SYN, ACK] Seq=0 Ack=1 Win=65535 Len=0 MSS=1412 SACK_PERM WS=256","","0x012"
"160","0.623134","142.250.75.100","10.100.102.162","TCP","66","[TCP Retransmission] 443  >  58346 [SYN, ACK] Seq=0 Ack=1 Win=65535 Len=0 MSS=1412 SACK_PERM WS=256","","0x012"
"161","0.623134","142.250.75.100","10.100.102.162","TCP","66","[TCP Retransmission] 443  >  58345 [SYN, ACK] Seq=0 Ack=1 Win=65535 Len=0 MSS=1412 SACK_PERM WS=256","","0x012"
"162","0.670989","10.100.102.162","142.250.75.206","QUIC","1292","Initial, DCID=8c9d4b8abd942b90, PKN: 1, CRYPTO, PING, PADDING, PING, PING, PADDING, CRYPTO, PING, PADDING, CRYPTO, PADDING, CRYPTO, PING, CRYPTO, CRYPTO, PING, PING","",""
"163","0.671073","10.100.102.162","142.250.75.206","QUIC","1292","Initial, DCID=8c9d4b8abd942b90, PKN: 2, PING, PING, PADDING, PING, PING, PADDING, CRYPTO, PING, PADDING, CRYPTO, CRYPTO, PADDING, CRYPTO, PING, PING, PADDING, CRYPTO, PADDING, CRYPTO","lh3.google.com",""
"164","0.725008","10.100.102.162","142.250.75.206","QUIC","1292","Initial, DCID=ec9d4b8abd942b90","",""
"165","0.740312","10.100.102.162","142.250.75.170","QUIC","1292","Initial, DCID=2fecd568a6ead777, PKN: 1, PING, PADDING, CRYPTO, PADDING, CRYPTO, PADDING, PING, PADDING, CRYPTO, PADDING, CRYPTO, PADDING, CRYPTO, CRYPTO, PING, CRYPTO, CRYPTO, PADDING","",""
"166","0.740442","10.100.102.162","142.250.75.170","QUIC","1292","Initial, DCID=2fecd568a6ead777, PKN: 2, CRYPTO, PING, PING, PADDING, PING, PADDING, CRYPTO, PING, CRYPTO, CRYPTO","ogads-pa.clients6.google.com",""
"167","0.772029","10.100.102.162","142.250.75.206","TCP","66","58353  >  443 [SYN] Seq=0 Win=65535 Len=0 MSS=1460 WS=256 SACK_PERM","","0x002"
"168","0.774755","10.100.102.162","142.250.75.206","QUIC","81","Handshake, DCID=ec9d4b8abd942b90","",""
"169","0.775365","10.100.102.162","142.250.75.206","QUIC","81","Handshake, DCID=ec9d4b8abd942b90","",""
"170","0.778576","10.100.102.162","142.250.75.206","QUIC","125","Handshake, DCID=ec9d4b8abd942b90","",""
"171","0.778841","10.100.102.162","142.250.75.206","QUIC","115","Protected Payload (KP0)","",""
"172","0.779578","10.100.102.162","142.250.75.206","QUIC","1288","Protected Payload (KP0)","",""
"173","0.779679","10.100.102.162","142.250.75.206","QUIC","757","Protected Payload (KP0)","",""
"174","0.792435","10.100.102.162","142.250.75.170","QUIC","1292","Initial, DCID=efecd568a6ead777","",""
"175","0.824455","142.250.75.206","10.100.102.162","TCP","66","443  >  58353 [SYN, ACK] Seq=0 Ack=1 Win=65535 Len=0 MSS=1412 SACK_PERM WS=256","","0x012"
"176","0.824574","10.100.102.162","142.250.75.206","TCP","54","58353  >  443 [ACK] Seq=1 Ack=1 Win=65280 Len=0","","0x010"
"177","0.825186","10.100.102.162","142.250.75.206","TCP","1466","58353  >  443 [ACK] Seq=1 Ack=1 Win=65280 Len=1412 [TCP PDU reassembled in 178]","","0x010"
"178","0.825186","10.100.102.162","142.250.75.206","TLSv1.3","430","Client Hello (SNI=lh3.google.com)","lh3.google.com","0x018"
"179","0.828970","10.100.102.162","142.250.75.206","QUIC","74","Protected Payload (KP0)","",""
"180","0.829443","10.100.102.162","142.250.75.170","TCP","66","58354  >  443 [SYN] Seq=0 Win=65535 Len=0 MSS=1460 WS=256 SACK_PERM","","0x002"
"181","0.843512","10.100.102.162","142.250.75.170","QUIC","81","Handshake, DCID=efecd568a6ead777","",""
"182","0.843737","10.100.102.162","142.250.75.170","QUIC","81","Handshake, DCID=efecd568a6ead777","",""
"183","0.843785","10.100.102.162","142.250.75.170","QUIC","79","Handshake, DCID=efecd568a6ead777","",""
"184","0.845093","10.100.102.162","142.250.75.170","QUIC","125","Handshake, DCID=efecd568a6ead777","",""
"185","0.845203","10.100.102.162","142.250.75.170","QUIC","112","Protected Payload (KP0)","",""
"186","0.845461","10.100.102.162","142.250.75.170","QUIC","478","Protected Payload (KP0)","",""
"187","0.853116","10.100.102.162","142.250.75.46","TCP","66","58355  >  443 [SYN] Seq=0 Win=65535 Len=0 MSS=1460 WS=256 SACK_PERM","","0x002"
"188","0.875248","142.250.75.206","10.100.102.162","TCP","66","[TCP Dup ACK 175#1] 443  >  58353 [ACK] Seq=1 Ack=1 Win=269824 Len=0 SLE=1413 SRE=1789","","0x010"
"189","0.875248","142.250.75.206","10.100.102.162","TCP","60","443  >  58353 [ACK] Seq=1 Ack=1789 Win=268288 Len=0","","0x010"
"190","0.879299","142.250.75.170","10.100.102.162","TCP","66","443  >  58354 [SYN, ACK] Seq=0 Ack=1 Win=65535 Len=0 MSS=1412 SACK_PERM WS=256","","0x012"
"191","0.879365","10.100.102.162","142.250.75.170","TCP","54","58354  >  443 [ACK] Seq=1 Ack=1 Win=65280 Len=0","","0x010"
"192","0.879515","10.100.102.162","142.250.75.206","QUIC","74","Protected Payload (KP0)","",""
"193","0.879857","10.100.102.162","142.250.75.170","TCP","1466","58354  >  443 [ACK] Seq=1 Ack=1 Win=65280 Len=1412 [TCP PDU reassembled in 194]","","0x010"
"194","0.879857","10.100.102.162","142.250.75.170","TLSv1.3","412","Client Hello (SNI=ogads-pa.clients6.google.com)","ogads-pa.clients6.google.com","0x018"
"195","0.894456","10.100.102.162","142.250.75.170","QUIC","75","Protected Payload (KP0)","",""
"196","0.894500","10.100.102.162","142.250.75.170","QUIC","75","Protected Payload (KP0)","",""
"197","0.894541","10.100.102.162","142.250.75.170","QUIC","75","Protected Payload (KP0)","",""
"198","0.901818","10.100.102.162","142.250.75.206","QUIC","77","Protected Payload (KP0)","",""
"199","0.902565","10.100.102.162","142.250.75.206","QUIC","83","Protected Payload (KP0)","",""
"200","0.902967","142.250.75.46","10.100.102.162","TCP","66","443  >  58355 [SYN, ACK] Seq=0 Ack=1 Win=65535 Len=0 MSS=1412 SACK_PERM WS=256","","0x012"
"201","0.903029","10.100.102.162","142.250.75.46","TCP","54","58355  >  443 [ACK] Seq=1 Ack=1 Win=65280 Len=0","","0x010"
"202","0.903901","10.100.102.162","142.250.75.46","TCP","1466","58355  >  443 [ACK] Seq=1 Ack=1 Win=65280 Len=1412 [TCP PDU reassembled in 203]","","0x010"
"203","0.903901","10.100.102.162","142.250.75.46","TLSv1.3","367","Client Hello (SNI=www.youtube.com)","www.youtube.com","0x018"
"204","0.928425","142.250.75.206","10.100.102.162","TLSv1.3","1466","Server Hello, Change Cipher Spec","","0x010"
"205","0.928425","142.250.75.206","10.100.102.162","TCP","1466","443  >  58353 [PSH, ACK] Seq=1413 Ack=1789 Win=268288 Len=1412 [TCP PDU reassembled in 211]","","0x018"
"206","0.928540","10.100.102.162","142.250.75.206","TCP","54","58353  >  443 [ACK] Seq=1789 Ack=2825 Win=65280 Len=0","","0x010"
"207","0.928851","142.250.75.206","10.100.102.162","TCP","1466","443  >  58353 [ACK] Seq=2825 Ack=1789 Win=268288 Len=1412 [TCP PDU reassembled in 211]","","0x010"
"208","0.929004","142.250.75.206","10.100.102.162","TCP","1466","443  >  58353 [PSH, ACK] Seq=4237 Ack=1789 Win=268288 Len=1412 [TCP PDU reassembled in 211]","","0x018"
"209","0.929053","10.100.102.162","142.250.75.206","TCP","54","58353  >  443 [ACK] Seq=1789 Ack=5649 Win=65280 Len=0","","0x010"
"210","0.929461","142.250.75.206","10.100.102.162","TCP","1466","443  >  58353 [ACK] Seq=5649 Ack=1789 Win=268288 Len=1412 [TCP PDU reassembled in 211]","","0x010"
"211","0.929461","142.250.75.206","10.100.102.162","TLSv1.3","852","Application Data","","0x018"
"212","0.929520","10.100.102.162","142.250.75.206","TCP","54","58353  >  443 [ACK] Seq=1789 Ack=7859 Win=65280 Len=0","","0x010"
"213","0.930235","10.100.102.162","142.250.75.206","TLSv1.3","128","Change Cipher Spec, Application Data","","0x018"
"214","0.931678","142.250.75.170","10.100.102.162","TCP","66","[TCP Dup ACK 190#1] 443  >  58354 [ACK] Seq=1 Ack=1 Win=269824 Len=0 SLE=1413 SRE=1771","","0x010"
"215","0.931678","142.250.75.170","10.100.102.162","TCP","60","443  >  58354 [ACK] Seq=1 Ack=1771 Win=268288 Len=0","","0x010"
"216","0.950263","10.100.102.162","142.250.75.170","QUIC","79","Protected Payload (KP0)","",""
"217","0.955593","142.250.75.46","10.100.102.162","TCP","66","[TCP Dup ACK 200#1] 443  >  58355 [ACK] Seq=1 Ack=1 Win=269824 Len=0 SLE=1413 SRE=1726","","0x010"
"218","0.955593","142.250.75.46","10.100.102.162","TCP","60","443  >  58355 [ACK] Seq=1 Ack=1726 Win=268288 Len=0","","0x010"
"219","0.956344","10.100.102.162","142.250.75.170","QUIC","1292","Initial, DCID=a6347a86caa2a56a, PKN: 1, CRYPTO, CRYPTO, PING, CRYPTO, PING, CRYPTO, CRYPTO","",""
"220","0.956431","10.100.102.162","142.250.75.170","QUIC","1292","Initial, DCID=a6347a86caa2a56a, PKN: 2, PING, PING, CRYPTO, PING, CRYPTO, PING, CRYPTO","ogads-pa.clients6.google.com",""
"221","0.956718","10.100.102.162","142.250.75.170","QUIC","123","0-RTT, DCID=a6347a86caa2a56a","",""
"222","0.980491","142.250.75.206","10.100.102.162","TCP","56","443  >  58353 [ACK] Seq=7859 Ack=1863 Win=268288 Len=0","","0x010"
"223","0.980491","142.250.75.206","10.100.102.162","TLSv1.3","1012","Application Data, Application Data","","0x018"
"224","0.980692","10.100.102.162","142.250.75.170","QUIC","76","Protected Payload (KP0)","",""
"225","0.983763","142.250.75.170","10.100.102.162","TLSv1.3","1466","Server Hello, Change Cipher Spec","","0x010"
"226","0.983763","142.250.75.170","10.100.102.162","TCP","1466","443  >  58354 [PSH, ACK] Seq=1413 Ack=1771 Win=268288 Len=1412 [TCP PDU reassembled in 235]","","0x018"
"227","0.983763","142.250.75.170","10.100.102.162","TCP","1466","443  >  58354 [ACK] Seq=2825 Ack=1771 Win=268288 Len=1412 [TCP PDU reassembled in 235]","","0x010"
"228","0.983871","10.100.102.162","142.250.75.170","TCP","54","58354  >  443 [ACK] Seq=1771 Ack=4237 Win=65280 Len=0","","0x010"
"229","0.984152","142.250.75.170","10.100.102.162","TCP","1466","443  >  58354 [PSH, ACK] Seq=4237 Ack=1771 Win=268288 Len=1412 [TCP PDU reassembled in 235]","","0x018"
"230","0.984152","142.250.75.170","10.100.102.162","TCP","1466","443  >  58354 [ACK] Seq=5649 Ack=1771 Win=268288 Len=1412 [TCP PDU reassembled in 235]","","0x010"
"231","0.984200","10.100.102.162","142.250.75.170","TCP","54","58354  >  443 [ACK] Seq=1771 Ack=7061 Win=65280 Len=0","","0x010"
"232","0.984471","142.250.75.170","10.100.102.162","TCP","1466","443  >  58354 [PSH, ACK] Seq=7061 Ack=1771 Win=268288 Len=1412 [TCP PDU reassembled in 235]","","0x018"
"233","0.984522","10.100.102.162","142.250.75.170","TCP","54","58354  >  443 [ACK] Seq=1771 Ack=8473 Win=65280 Len=0","","0x010"
"234","0.985005","142.250.75.170","10.100.102.162","TCP","1466","443  >  58354 [ACK] Seq=8473 Ack=1771 Win=268288 Len=1412 [TCP PDU reassembled in 235]","","0x010"
"235","0.985005","142.250.75.170","10.100.102.162","TLSv1.3","1066","Application Data","","0x018"
"236","0.985047","10.100.102.162","142.250.75.170","TCP","54","58354  >  443 [ACK] Seq=1771 Ack=10897 Win=65280 Len=0","","0x010"
"237","0.985549","10.100.102.162","142.250.75.170","TLSv1.3","128","Change Cipher Spec, Application Data","","0x018"
"238","1.007486","142.250.75.46","10.100.102.162","TLSv1.3","1466","Server Hello, Change Cipher Spec","","0x010"
"239","1.008147","142.250.75.46","10.100.102.162","TCP","1466","443  >  58355 [PSH, ACK] Seq=1413 Ack=1726 Win=268288 Len=1412 [TCP PDU reassembled in 245]","","0x018"
"240","1.008176","10.100.102.162","142.250.75.46","TCP","54","58355  >  443 [ACK] Seq=1726 Ack=2825 Win=65280 Len=0","","0x010"
"241","1.008478","142.250.75.46","10.100.102.162","TCP","1466","443  >  58355 [ACK] Seq=2825 Ack=1726 Win=268288 Len=1412 [TCP PDU reassembled in 245]","","0x010"
"242","1.008478","142.250.75.46","10.100.102.162","TCP","1466","443  >  58355 [PSH, ACK] Seq=4237 Ack=1726 Win=268288 Len=1412 [TCP PDU reassembled in 245]","","0x018"
"243","1.008490","10.100.102.162","142.250.75.46","TCP","54","58355  >  443 [ACK] Seq=1726 Ack=5649 Win=65280 Len=0","","0x010"
"244","1.009358","142.250.75.46","10.100.102.162","TCP","1466","443  >  58355 [ACK] Seq=5649 Ack=1726 Win=268288 Len=1412 [TCP PDU reassembled in 245]","","0x010"
"245","1.009358","142.250.75.46","10.100.102.162","TLSv1.3","853","Application Data","","0x018"
"246","1.009380","10.100.102.162","142.250.75.46","TCP","54","58355  >  443 [ACK] Seq=1726 Ack=7860 Win=65280 Len=0","","0x010"
"247","1.011210","10.100.102.162","142.250.75.46","TLSv1.3","128","Change Cipher Spec, Application Data","","0x018"
"248","1.025834","10.100.102.162","142.250.75.129","QUIC","1292","Initial, DCID=f276795f784c6f54, PKN: 1, CRYPTO, PADDING, CRYPTO, PING, PADDING, CRYPTO, PADDING, PING, PING, PING, CRYPTO, CRYPTO, PADDING, CRYPTO, PING","",""
"249","1.025881","10.100.102.162","142.250.75.129","QUIC","1292","Initial, DCID=f276795f784c6f54, PKN: 2, CRYPTO, CRYPTO, PING, CRYPTO, CRYPTO, PADDING, CRYPTO, CRYPTO, CRYPTO, PING, CRYPTO, CRYPTO, PING, CRYPTO, PADDING","lh3.googleusercontent.com",""
"250","1.032380","10.100.102.162","142.250.75.206","TCP","54","58353  >  443 [ACK] Seq=1863 Ack=8817 Win=64512 Len=0","","0x010"
"251","1.036000","142.250.75.170","10.100.102.162","TCP","56","443  >  58354 [ACK] Seq=10897 Ack=1845 Win=268288 Len=0","","0x010"
"252","1.036000","142.250.75.170","10.100.102.162","TLSv1.3","1040","Application Data, Application Data","","0x018"
"253","1.060459","142.250.75.46","10.100.102.162","TCP","56","443  >  58355 [ACK] Seq=7860 Ack=1800 Win=268288 Len=0","","0x010"
"254","1.060572","10.100.102.162","142.250.75.170","QUIC","120","Handshake, DCID=e6347a86caa2a56a","",""
"255","1.060636","10.100.102.162","142.250.75.170","QUIC","73","Protected Payload (KP0)","",""
"256","1.060829","10.100.102.162","142.250.75.170","QUIC","1288","Protected Payload (KP0)","",""
"257","1.060824","142.250.75.46","10.100.102.162","TLSv1.3","1014","Application Data, Application Data","","0x018"
"258","1.060849","10.100.102.162","142.250.75.170","QUIC","1035","Protected Payload (KP0)","",""
"259","1.077892","10.100.102.162","142.250.75.129","QUIC","1292","Initial, DCID=f276795f784c6f54, PKN: 3, ACK, PADDING","",""
"260","1.080764","10.100.102.162","142.250.75.170","TCP","54","58354  >  443 [ACK] Seq=1845 Ack=11883 Win=64512 Len=0","","0x010"
"261","1.108807","10.100.102.162","142.250.75.46","TCP","54","58355  >  443 [ACK] Seq=1800 Ack=8820 Win=64512 Len=0","","0x010"
"262","1.109269","10.100.102.162","142.250.75.129","TCP","66","58356  >  443 [SYN] Seq=0 Win=65535 Len=0 MSS=1460 WS=256 SACK_PERM","","0x002"
"263","1.133515","10.100.102.162","142.250.75.129","QUIC","79","Handshake, DCID=f276795f784c6f54","",""
"264","1.140555","10.100.102.162","142.250.75.129","QUIC","81","Handshake, DCID=f276795f784c6f54","",""
"265","1.141061","10.100.102.162","142.250.75.129","QUIC","81","Handshake, DCID=f276795f784c6f54","",""
"266","1.142330","10.100.102.162","142.250.75.170","QUIC","74","Protected Payload (KP0)","",""
"267","1.145242","10.100.102.162","142.250.75.129","QUIC","125","Handshake, DCID=f276795f784c6f54","",""
"268","1.145470","10.100.102.162","142.250.75.129","QUIC","116","Protected Payload (KP0)","",""
"269","1.146172","10.100.102.162","142.250.75.129","QUIC","1288","Protected Payload (KP0)","",""
"270","1.146238","10.100.102.162","142.250.75.129","QUIC","501","Protected Payload (KP0)","",""
"271","1.187638","10.100.102.162","142.250.75.129","QUIC","206","Protected Payload (KP0)","",""
"272","1.187797","10.100.102.162","142.250.75.129","QUIC","1292","Protected Payload (KP0)","",""
"273","1.188210","142.250.75.129","10.100.102.162","TCP","66","443  >  58356 [SYN, ACK] Seq=0 Ack=1 Win=65535 Len=0 MSS=1412 SACK_PERM WS=256","","0x012"
"274","1.188299","10.100.102.162","142.250.75.129","TCP","54","58356  >  443 [ACK] Seq=1 Ack=1 Win=65280 Len=0","","0x010"
"275","1.189050","10.100.102.162","142.250.75.129","TCP","1466","58356  >  443 [ACK] Seq=1 Ack=1 Win=65280 Len=1412 [TCP PDU reassembled in 276]","","0x010"
"276","1.189050","10.100.102.162","142.250.75.129","TLSv1.3","409","Client Hello (SNI=lh3.googleusercontent.com)","lh3.googleusercontent.com","0x018"
"277","1.194520","10.100.102.162","142.250.75.170","QUIC","77","Protected Payload (KP0)","",""
"278","1.194751","10.100.102.162","142.250.75.129","QUIC","75","Protected Payload (KP0)","",""
"279","1.194834","10.100.102.162","142.250.75.129","QUIC","75","Protected Payload (KP0)","",""
"280","1.244345","142.250.75.129","10.100.102.162","TCP","60","443  >  58356 [ACK] Seq=1 Ack=1413 Win=268288 Len=0","","0x010"
"281","1.244345","142.250.75.129","10.100.102.162","TCP","60","443  >  58356 [ACK] Seq=1 Ack=1768 Win=268032 Len=0","","0x010"
"282","1.250411","10.100.102.162","142.250.75.129","QUIC","74","Protected Payload (KP0)","",""
"283","1.291039","142.250.75.129","10.100.102.162","TLSv1.3","1466","Server Hello, Change Cipher Spec","","0x010"
"284","1.291039","142.250.75.129","10.100.102.162","TCP","1466","443  >  58356 [PSH, ACK] Seq=1413 Ack=1768 Win=268032 Len=1412 [TCP PDU reassembled in 292]","","0x018"
"285","1.291102","10.100.102.162","142.250.75.129","TCP","54","58356  >  443 [ACK] Seq=1768 Ack=2825 Win=65280 Len=0","","0x010"
"286","1.291325","142.250.75.129","10.100.102.162","TCP","1466","443  >  58356 [ACK] Seq=2825 Ack=1768 Win=268032 Len=1412 [TCP PDU reassembled in 292]","","0x010"
"287","1.292188","142.250.75.129","10.100.102.162","TCP","1466","443  >  58356 [PSH, ACK] Seq=4237 Ack=1768 Win=268032 Len=1412 [TCP PDU reassembled in 292]","","0x018"
"288","1.292188","142.250.75.129","10.100.102.162","TCP","1466","443  >  58356 [ACK] Seq=5649 Ack=1768 Win=268032 Len=1412 [TCP PDU reassembled in 292]","","0x010"
"289","1.292188","142.250.75.129","10.100.102.162","TCP","1466","443  >  58356 [PSH, ACK] Seq=7061 Ack=1768 Win=268032 Len=1412 [TCP PDU reassembled in 292]","","0x018"
"290","1.292188","142.250.75.129","10.100.102.162","TCP","1466","443  >  58356 [ACK] Seq=8473 Ack=1768 Win=268032 Len=1412 [TCP PDU reassembled in 292]","","0x010"
"291","1.292255","10.100.102.162","142.250.75.129","TCP","54","58356  >  443 [ACK] Seq=1768 Ack=9885 Win=65280 Len=0","","0x010"
"292","1.292709","142.250.75.129","10.100.102.162","TLSv1.3","661","Application Data","","0x018"
"293","1.292857","10.100.102.162","142.250.75.129","TCP","54","58356  >  443 [ACK] Seq=1768 Ack=10492 Win=64768 Len=0","","0x010"
"294","1.293436","10.100.102.162","142.250.75.129","TLSv1.3","128","Change Cipher Spec, Application Data","","0x018"
"295","1.302304","10.100.102.162","142.250.75.129","QUIC","77","Protected Payload (KP0)","",""
"296","1.332932","10.100.102.162","142.250.75.129","QUIC","74","Protected Payload (KP0)","",""
"297","1.350577","142.250.75.129","10.100.102.162","TCP","56","443  >  58356 [ACK] Seq=10492 Ack=1842 Win=268032 Len=0","","0x010"
"298","1.350577","142.250.75.129","10.100.102.162","TLSv1.3","1034","Application Data, Application Data","","0x018"
"299","1.379193","10.100.102.162","13.107.42.16","TCP","66","58357  >  443 [SYN] Seq=0 Win=65535 Len=0 MSS=1460 WS=256 SACK_PERM","","0x002"
"300","1.394393","10.100.102.162","142.250.75.129","TCP","54","58356  >  443 [ACK] Seq=1842 Ack=11472 Win=65280 Len=0","","0x010"
"301","1.429550","13.107.42.16","10.100.102.162","TCP","66","443  >  58357 [SYN, ACK] Seq=0 Ack=1 Win=65535 Len=0 MSS=1440 WS=256 SACK_PERM","","0x012"
"302","1.429755","10.100.102.162","13.107.42.16","TCP","54","58357  >  443 [ACK] Seq=1 Ack=1 Win=65280 Len=0","","0x010"
"303","1.431126","10.100.102.162","13.107.42.16","TCP","1494","58357  >  443 [ACK] Seq=1 Ack=1 Win=65280 Len=1440 [TCP PDU reassembled in 304]","","0x010"
"304","1.431126","10.100.102.162","13.107.42.16","TLSv1.2","377","Client Hello (SNI=config.edge.skype.com)","config.edge.skype.com","0x018"
"305","1.481196","13.107.42.16","10.100.102.162","TCP","60","443  >  58357 [ACK] Seq=1 Ack=1764 Win=4194816 Len=0","","0x010"
"306","1.482744","13.107.42.16","10.100.102.162","TCP","1506","443  >  58357 [ACK] Seq=1 Ack=1764 Win=4194816 Len=1452 [TCP PDU reassembled in 311]","","0x010"
"307","1.482744","13.107.42.16","10.100.102.162","TCP","1506","443  >  58357 [ACK] Seq=1453 Ack=1764 Win=4194816 Len=1452 [TCP PDU reassembled in 311]","","0x010"
